ticker,headline,datetime,source,url,sentiment
TSLA,"Dow Jones Futures Loom, Palantir Looks To Rebound; More Big Tesla News Due",1759696112,Yahoo,https://finnhub.io/api/news?id=039541b889ccea3606df7c676671362ca0a41db808272c0cbca257c82eaa55fb,positive
TSLA,"Tesla FSD v14 Release Coming Monday, Elon Musk Says",1759691208,Yahoo,https://finnhub.io/api/news?id=ca17f1067b5c6f71e63c4e629e0917f100b5fb6555124e44ec07e199786be21f,neutral
TSLA,Jim Cramer Reveals Major Potential Catalyst For Ford (F),1759689057,Yahoo,https://finnhub.io/api/news?id=eecffbd8b16d9a1b9029f1446a0ca61bafbc15649030e3a2276a10f7be7411a8,neutral
TSLA,4 Reasons to Buy Tesla Stock and 1 Reason Not To,1759688160,Yahoo,https://finnhub.io/api/news?id=918718e4999ccc0ac2b2261e397880fdc43ee8d60506416e62e696915e870df3,neutral
TSLA,Rivian vs. Lucid: Which EV Stock is Winning in 2025?,1759686600,Yahoo,https://finnhub.io/api/news?id=925f0588c5df60028ceb42eedd1124cfb3fd0a5bac295d04411ced5c72d5a3b4,neutral
TSLA,"Government Shutdown, OpenAI Conference and Other Can't Miss Items this Week",1759683602,Yahoo,https://finnhub.io/api/news?id=4b81a158e3f09e66ef041cae64e6e7cb9689ad4cb529ff16bbf29fe48e962387,neutral
TSLA,TechCrunch Mobility: Toyota makes a $1.5B bet on the startup ecosystem,1759680180,Yahoo,https://finnhub.io/api/news?id=387f33f14663d8b87eae49eceb08a7c27fee526fbbb7c03bc4ed6aadee86cf8d,neutral
TSLA,Former Tesla Executive Recommends General Motors (GM) Stock,1759671996,Yahoo,https://finnhub.io/api/news?id=b4ee93795b47f722d60d1321f27df092543bfcedd4beb35ef2e753a551f12190,neutral
TSLA,"Wall Street, crypto industry say tokenization will reshape global markets: 'It’s going to eat the entire financial system'",1759671005,Yahoo,https://finnhub.io/api/news?id=bc3d53bf653acf166de547edf6082268739be3ae72c5a6fd554f90ee2bff63f2,negative
TSLA,Elon Musk Just Spent $1 Billion on Tesla Stock: Here’s What This Means for Investors,1759666746,Yahoo,https://finnhub.io/api/news?id=f96e11aef3841c847d9589a4f1011be4c6dd1fa045e237996bddd04e623569af,neutral
TSLA,Stocks trade at record highs as government shutdown leaves economic data in limbo: What to watch,1759664246,Yahoo,https://finnhub.io/api/news?id=8a989def017623b5fc6a88876f46743e93ef8b85be128bd6f058b9c782d3462c,negative
TSLA,"Prediction: Tesla Stock May Be ""Dreadful"" in 2026",1759659600,Yahoo,https://finnhub.io/api/news?id=415bd3458f07d1377eee2bc39228a5e6aacffc5438df8df6d213b0ebb52c92ab,negative
TSLA,More CEOs want Elon Musk–style ‘moonshot’ pay packages—but comp experts are raising alarms,1759658640,Yahoo,https://finnhub.io/api/news?id=8f21d6d2d9a98ee83a73b3637bdeb1594e610f63dc2fa52f4ad4289fcc7f768d,neutral
TSLA,Used EVs are an 'amazing bargain' for car buyers,1759658450,Yahoo,https://finnhub.io/api/news?id=9b5335bb5cd3b8b4dc989aab97193ae4c242e77a372c379151afde28305626a9,positive
TSLA,"1 Unstoppable Cryptocurrency to Buy Before It Soars 18,271%, According to MicroStrategy's Michael Saylor",1759655400,Yahoo,https://finnhub.io/api/news?id=22e44a631f7df54ca9671c1df2c2d8800844a64ba0485894af6e81eec768cbb6,neutral
TSLA,Where Will Tesla Be in 10 Years?,1759654200,Yahoo,https://finnhub.io/api/news?id=e6dc72b9f655be738376825bdb8c24c37bc3c80c41815d88db6896d1a9147cb5,neutral
TSLA,Tesla Inc. (TSLA) Receives EV Sales Boost in Europe in September,1759646553,Yahoo,https://finnhub.io/api/news?id=47f233769af503cd2ff3b1ee6f68c4cc8d599b60945885767f4db6084d34d267,positive
TSLA,"Tesla May Be Behind in Driverless Vehicles, but Here's a Silver Lining",1759615500,Yahoo,https://finnhub.io/api/news?id=ef3e91d1b5ee0177fe9764ad473275af0904ac75b7c31062f63433e20c14bb5f,neutral
TSLA,Larry Ellison Dropped Out of College Twice and Now Has $349.5 Billion — How He Did It,1759612747,Yahoo,https://finnhub.io/api/news?id=c7aa6e3e620b196e8894403cc2f65d10e07cff064b88f1f2f2f14f4abd89dc45,neutral
TSLA,California regulators threaten to revoke Tesla's insurance license for mishandling claims,1759601382,Yahoo,https://finnhub.io/api/news?id=6fd4ec874a5a5b3adb8755c36f2761ce76857069bb8eaef69fb0f66dd9fb8cea,negative
TSLA,AI: The Bubble Driving The Economy And The Markets,1759512158,SeekingAlpha,https://finnhub.io/api/news?id=aca186f305cc18652dd8a66e108e200eb14406d9910f89b1c7c87f65dceda08b,neutral
TSLA,"Tesla news: Q3 deliveries, Cybertruck lawsuit, Elon Musk's pay",1759501501,Yahoo,https://finnhub.io/api/news?id=5b5657cb10db087ba18cb71038f0b7f35fd2bbb8dc50ce01663f9bad876d3b59,neutral
TSLA,"If You Bought $1,000 of Tesla Stock Every Month Since 2020, Here’s How Much You’d Have Now",1759500307,Yahoo,https://finnhub.io/api/news?id=45c1d99eb791435fbaddbbd6205e608883879d77e9af42ffa101f9252ec5f0c2,neutral
TSLA,Analyst Says He Doesn’t See ‘Any Upside’ For Tesla Stock – Here’s Why,1759500002,Yahoo,https://finnhub.io/api/news?id=a8c58f44a04220c6e969d1cf116059e1148e7ed03ceb610a9666a73c3966f012,neutral
TSLA,Tesla Stock Rises. Up Next: A Vote on Musk’s Pay.,1759498620,Yahoo,https://finnhub.io/api/news?id=9e038db03b416d92f3a205e9b9e2b002a5024973b89963e57951cf7355fcf056,neutral
TSLA,"Apple Adds a Bear as Jefferies Downgrades, Sees 20% Downside",1759498402,Yahoo,https://finnhub.io/api/news?id=9cf8dcacd1639898e6bec483f151bd527abdde717bb8644f1fdba4e79dd7bfbd,negative
TSLA,Tesla (TSLA) Valuation: Examining Q3’s Record Deliveries and Policy-Driven Demand Boost,1759498207,Yahoo,https://finnhub.io/api/news?id=ffb40ab9189e1594ffbe8db4682f05a30b99a8f6e3015bd72b5782f22fc7f008,positive
TSLA,Analyst Explains Tesla’s (TSLA) ‘Big Question’ and New Struggles,1759498178,Yahoo,https://finnhub.io/api/news?id=00fec36c5655fc9433adc53c5eb31e5ade3963727e6cafe432f600c4a676ebb1,neutral
TSLA,"BYD, Nio, XPeng Stock Falls After Tesla Crushes Wall Street Delivery Estimates",1759496755,Yahoo,https://finnhub.io/api/news?id=5562b1d1fc973f8117158327f5db7d5f01e0bfac3094882d9caa73550a6b2a0d,negative
TSLA,Tesla Investors Push Back on Elon Musk's $1 Trillion Pay Deal,1759496559,Yahoo,https://finnhub.io/api/news?id=b63fb8d3918e4c337bf07680936e01b3589448927bb0b9361baa5cd211dc3d97,negative
TSLA,"Tech Insider In Exclusive Interview: ""Why Elon Musk May Have No Choice but to Unlock Billions Through a Starlink Spinoff""",1759496400,Yahoo,https://finnhub.io/api/news?id=c6d58f58029cc296aeb0e710bf6fa97e8943d205797e372e7200c63c6d2c919e,neutral
TSLA,Enterprise Development Holdings Sells Tesla and Palantir Stakes Worth $12.7 Million,1759496357,Yahoo,https://finnhub.io/api/news?id=319d2c760d30ba31895a957785466a721c96a4d7ac9ea8af020cac94e91697b5,neutral
TSLA,Tesla Just Crushed Delivery Records--But the Real Shock Is What Comes Next,1759496140,Yahoo,https://finnhub.io/api/news?id=389a6f18c2066a5e4cadebf8fb833c6b96053a9af40e3fccdfbd2dd0cf24deaa,neutral
TSLA,"Stock Market Today: Dow Rises As Jobs Report Nixed; Astera, Nvidia, Tesla Rally (Live Coverage)",1759495713,Yahoo,https://finnhub.io/api/news?id=6969d0c423a6e0797d05d5c01add29c392e7a3efdfed7370d9ac8b388ce86dec,neutral
TSLA,Tesla Stock Bounces Back After Deliveries Cause Drop. Up Next: A Vote on Musk’s Pay.,1759494600,Yahoo,https://finnhub.io/api/news?id=fa79c0fcb4b920c1e1fa37cbe50d26041e2098961a7c1cd77b474d95c02c8d08,neutral
TSLA,Tesla UK sales flat in September despite broader EV market growth,1759494006,Yahoo,https://finnhub.io/api/news?id=cd8a1c8a646db833c1833ea55656c966bfa001785f9566cb1cf2d20725f74a4f,negative
TSLA,Beyond Tesla: Why GM and Ford Heavy ETFs Could Be Safer Bets Now?,1759494000,Yahoo,https://finnhub.io/api/news?id=af42f2953eced3139ff5e871c5a2835fe2e91a566dbf98daa1310e52bc44bf13,neutral
TSLA,"New Nvidia deal, Asahi sparks beer shortage fears & Tesla rebounds",1759493030,Yahoo,https://finnhub.io/api/news?id=b0159bb2cbbb113f9440b76e4fe9be919751759e1bcdd1c5cd44ae201aafbcce,negative
TSLA,"The Week in Numbers: hot valuations, a YouTube payout",1759491266,Yahoo,https://finnhub.io/api/news?id=5ccbbbe52e814dac73203a09aec2db2a7602cb0ad6b6d36d11f1b90a01fb176d,neutral
TSLA,Stocks Rise Pre-Bell as Government Shutdown Continues,1759490802,Yahoo,https://finnhub.io/api/news?id=260158acc61843cd75cbf3c250e7bbb26d09f446b3854238ff3f2177d4dc3048,negative
TSLA,"Dow Jones Futures Rise, Tesla Tries To Steady; Jobs Report Shut Down",1759489262,Yahoo,https://finnhub.io/api/news?id=7c6da13585ccffda6b0412eeac8121a9fa57cd650700c882bfc4ed64f1ae3ec5,negative
TSLA,Musk ​Goes Head-to-Head With Altman. But This AI Stock Is the Winner.,1759488240,Yahoo,https://finnhub.io/api/news?id=1fa6a7f441ccb4b4810fbb748a821130419c5189ea7b7aaec2950add3b6734a9,neutral
TSLA,Electric Vehicles Update - Shifting Strategies In A Transforming Auto Industry Landscape,1759487992,Yahoo,https://finnhub.io/api/news?id=2c1a36480e8cca51163dc42265888968038cbf09e0bb21bf8859b3003a2b430a,neutral
TSLA,"These Stocks Are Moving the Most Today: Tesla, Applied Materials, Boeing, Rumble, and More",1759487520,Yahoo,https://finnhub.io/api/news?id=cbd58f32b628f43e8d160ea3f14aab9f725880dda77babd8539315ed044e2a6b,neutral
TSLA,"Tesla's tax credits are ending, but the AI benefit is only beginning",1759485656,Yahoo,https://finnhub.io/api/news?id=b51dc7115cf84e36ee000d4483a61901703c9999634e8c6406cade97c1c87937,negative
TSLA,"Q3 EV Wars: Who Won, Who Lost?",1759485197,SeekingAlpha,https://finnhub.io/api/news?id=79fb046be00ad0f2b2e7bff58e99bc620a0b4e17bc69e257a72057ed99a330fa,neutral
TSLA,Tesla Stock Tanked After Decent Deliveries. Why Musk’s Pay Package Will Pass.,1759484220,Yahoo,https://finnhub.io/api/news?id=99195ab7f1b2a1a9173f6c465400d55353ba7d8a345bf6868053b88dd7707665,negative
TSLA,"Trending tickers: Tesla, Alibaba, Occidental, Asahi, Wetherspoon",1759482135,Yahoo,https://finnhub.io/api/news?id=b02529a8b40c40337a36cc417b5f2c8262c790da4f4190ac91248afadc1a19dd,neutral
TSLA,Tesla Shareholder Group Urges Investors to Vote Against CEO Musk's $1 Trillion Pay Package,1759480400,Yahoo,https://finnhub.io/api/news?id=81c12f3c1f1a81ebe19cfdf7aeb7bddd11a9fb40bc357a8ec2019eaf90cd82b1,negative
TSLA,Tesla vehicle sales made a comeback last quarter. Will a lost EV tax credit end the rebound?,1759478400,Yahoo,https://finnhub.io/api/news?id=acae1263cf4cb7f5802985993aff037f765d68f45caa0113911f0f72764ba678,negative
TSLA,Podcast: Trump Raises Pressure on Democrats as Shutdown Continues,1759476735,Yahoo,https://finnhub.io/api/news?id=9c3cebafa72e5ff946e6f5e32b0502061c53672d45a2d229a8c83e18f099bff0,negative
TSLA,Heard on the Street Thursday Recap: Taking Credit,1759476708,Yahoo,https://finnhub.io/api/news?id=25f3fdbfce6e806de6c60f97fbcba2f4905ac485a8415036de20d65bc32146b1,neutral
TSLA,Tesla sales jump after months of boycotts: Can the momentum continue?,1759476140,Yahoo,https://finnhub.io/api/news?id=76f628c208e5e15c7691e28c11e2648c75725ec663fd215eb7441079f827a54d,positive
TSLA,Tesla's Comeback: Why Skeptics Like Me Are Becoming Believers (Upgrade),1759463836,SeekingAlpha,https://finnhub.io/api/news?id=aea62770d96c3e0fd6488ecc3d78b3ef742b573f2468b2dbf4b20c97a0447ae4,neutral
TSLA,Dow Jones Futures Rise; AI Stocks In Buy Areas As Tesla Sells The News,1759460811,Yahoo,https://finnhub.io/api/news?id=93e91bcb606e8daed52c12a03a6b6fa1b9965ad9e20044f09f8bd6b7e8dd8cd6,positive
TSLA,Tesla Shareholders Urged to Reject $1 Trillion Pay for Elon Musk,1759442880,Yahoo,https://finnhub.io/api/news?id=df63b2bfe481812e1a820a2d14e3db3eae756dce5e2d97206751d396af8c09c4,negative
TSLA,Tesla stock whipsaws after 3rd-quarter deliveries beat Wall Street's estimates,1759442377,Yahoo,https://finnhub.io/api/news?id=a24c5f90c95132daffbf23ecf920508e0dccce155f35ca5872df15744fdfa1c7,positive
TSLA,Tesla (TSLA) Stock Slides as Market Rises: Facts to Know Before You Trade,1759441506,Yahoo,https://finnhub.io/api/news?id=15151fc6ccee4e7d96faa130218c9a75e76a5de454b9be77a114510a4a3930cc,neutral
TSLA,Elon Musk Still Tops World’s Richest. This Billionaire Is Hot on His Heels.,1759441260,Yahoo,https://finnhub.io/api/news?id=9046f0149b8e21117c0988a1c1715e4488a0e5a937705ce897a0a6027a7a0e5b,neutral
TSLA,"Stocks to Watch Recap: Fair Isaac, Tesla, Stellantis, Netflix",1759441200,Yahoo,https://finnhub.io/api/news?id=1ef9ce18df54cf79133b94f22043579e5f6235de2853e6c4118612ac17c8684f,neutral
TSLA,"Musk Vs. Buffett: Tesla CEO Goes 'Cancel Netflix,' While Oracle Of Omaha Streams Live Boxing",1759440685,Yahoo,https://finnhub.io/api/news?id=dc97612f4b3ea3dcd82e925e2551c17d93bf8f1997c5ba7c48f491b5c0660a86,negative
TSLA,Podcast: U.S. Stocks Hit Record Highs on Shutdown’s Second Day,1759440602,Yahoo,https://finnhub.io/api/news?id=f3ea7abbfa46e2b82dbebfb14195bc013d87d769168f83bd8345834facba2f19,positive
TSLA,Wall Street Notches Fresh Records as Government Shutdown Drags On,1759439421,Yahoo,https://finnhub.io/api/news?id=d246c133012e5c9403e6e6abfe9265fae400b6e48cd19539117bdd78c71ca989,negative
TSLA,Tesla Sets New Sales Record as EV Subsidy Ends,1759438980,Yahoo,https://finnhub.io/api/news?id=37933bccd5abc6879d390ebf3688ef4d44fa76b62d067ee90ed2df18491089e8,positive
TSLA,Stock Market Today: Nasdaq Hits High Even As Tesla Sinks; China Stock Futu Trampled,1759438524,Yahoo,https://finnhub.io/api/news?id=ae2c2bd63ddde241df18988a22428af4a4c4b08cc3e572570dcec46cb9cb9812,positive
TSLA,Here's Why Tesla Shares Accelerated Higher in September,1759437709,Yahoo,https://finnhub.io/api/news?id=cf9ac2e9e2426801413243ca677fae0993641e2fae26682364e9f605e4908ef6,positive
TSLA,"Tesla posts strong sales as EV tax credit lapses, Musk becomes first $500 billion man",1759437601,Yahoo,https://finnhub.io/api/news?id=6b31f6098b10f5b7a6f95d9504b38ead1bad367275755c41ea6f95637e5bddc6,positive
TSLA,Heard on the Street Recap: Taking Credit,1759437449,Yahoo,https://finnhub.io/api/news?id=ded2d2ae9d731bdf3913cd42b5a9629f9d37e4a9fa29c303449b034a8d7ce1f8,neutral
TSLA,Las Vegas Police Department Gets Customized Cybertrucks: 'It Will Stop Bullets',1759437064,Yahoo,https://finnhub.io/api/news?id=3a66e6773c761a9a484e8004eb968e962a35f4e40f20aa34d3b43bcaeee4df39,neutral
TSLA,"These Stocks Moved the Most Today: Tesla, Rivian, Occidental, Fair Isaac, Fermi, Kodiak AI, Bullish, Rigetti, and More",1759436160,Yahoo,https://finnhub.io/api/news?id=f689a748f211e0a5d1d518a279f53be6825596f2eb0460b91491031a7f1f7bf9,neutral
TSLA,Tesla Stock Drops Despite Record Quarterly Deliveries. What Drove the Big Beat.,1759435800,Yahoo,https://finnhub.io/api/news?id=4f54361351c223f3d65b92983ef97e09bb12311cf23aa6c73afda049e88d7973,negative
TSLA,"Tesla Delivers Record 497,099 EVs In Q3 On Expiring Tax Credits. TSLA Stock Reverses Lower.",1759435447,Yahoo,https://finnhub.io/api/news?id=1ba4eafdc4d7597f567b9bbe6e2156af3ea7143de5743f08f7e580b60bb9a4ec,negative
TSLA,"Dow, S&P 500, Nasdaq notch records on AI buzz even as government shutdown drags on",1759435327,Yahoo,https://finnhub.io/api/news?id=1a76ab18f50030827d2535fb503f2e7aef64f0e9790d297247236f0b833fcdf5,negative
TSLA,Why Tesla (TSLA) Stock Is Trading Lower Today,1759432868,Yahoo,https://finnhub.io/api/news?id=52086b0315ad995d497c756ce22eb30c29d3d9582e698fd2e4193ea1a0622b17,negative
TSLA,Wall Street Lunch: Yahoo's AOL Heads To Italy In Potential Sale To Bending Spoons,1759413687,SeekingAlpha,https://finnhub.io/api/news?id=5dc1761afd9bb2b36c671b70a164ecea5f13d8b684faebe25c4f66aa9e2e6550,neutral
TSLA,"Tesla: Strong Q3, But Beware The Q4 Slump",1759412778,SeekingAlpha,https://finnhub.io/api/news?id=6c89d93b6493c3247a5ab8193e4b54487d6ea2ec56564fcc96ddff250d7e2511,negative
TSLA,Tesla reports blowout Q3 deliveries as buyers plow in before federal tax credit expires,1759411407,Yahoo,https://finnhub.io/api/news?id=e05390482b8585bb8f4e425986fcd681cb890442e19f2f76d9d8c9e38ca155a3,negative
TSLA,Tesla CEO Elon Musk Becomes First Person to Reach $500 Billion Net Worth,1759411077,Yahoo,https://finnhub.io/api/news?id=78bef3d624a7390159dcb89f2d3cfbc2dbe3c930c94ad97530f4689ee5a4f514,neutral
TSLA,"Tesla Delivered Record 497,099 EVs In Q3 On Expiring Tax Credits; TSLA Stock Rises (Live)",1759410851,Yahoo,https://finnhub.io/api/news?id=17aedba7cc9f63cc26f1d51078f0dc18cc09cf1a7948b099e28666ffa5d50d96,neutral
TSLA,"Tesla sales rose 7% in the third quarter as a rush by customers to use an expiring $7,5000 EV credit provided a boost",1759410490,Yahoo,https://finnhub.io/api/news?id=a83bcc1717332128dd445d58f41e49f87c025a0ee1499f0d007f05817b2bc031,positive
TSLA,Tesla Nears Record Highs -- Q3 Deliveries Set to Smash Wall Street Forecasts,1759410461,Yahoo,https://finnhub.io/api/news?id=87da2558ef24fd1e363d3071b2faac1169ec9980c06c024e435e58c3aeeb2e7e,positive
TSLA,"Tesla Third Quarter 2025 Production, Deliveries & Deployments",1759410240,Yahoo,https://finnhub.io/api/news?id=b2aac5647c9430991e1d11dacfa3e0f6f9eb2de44706335d39fc6efc7f8fb2fe,neutral
TSLA,"Tesla: Take Profits Before The Correction, Sales Trends Are Worsening (Downgrade)",1759408973,SeekingAlpha,https://finnhub.io/api/news?id=ba4553b5bfd305b5b576b27d3410d5a6e02b2a50cc0fa00724f6f8fc3faf74ec,negative
TSLA,Stock Market Today: Dow Falls As Jobless Data Gets The Ax; Tesla Jumps On Strong Deliveries (Live Coverage),1759411268,Yahoo,https://finnhub.io/api/news?id=7358a7323209342abdf9e0179e069fd98ca5baee77a5ab5e6a3e46b11c58fe7f,negative
TSLA,5 Things to Know Before the Stock Market Opens,1759407659,Yahoo,https://finnhub.io/api/news?id=86b29b449e3fddea26e6d922e68047ebf5c3518505ddb9fa9df786c4497597ed,neutral
TSLA,"Dow Jones Futures Fall, Techs Rise With Tesla Deliveries Due; Nvidia Partner In Buy Zone",1759407481,Yahoo,https://finnhub.io/api/news?id=f7943ecba869bef6ce264e5e32637b15637b6309088b3bdca9b611ab35e8d4cd,negative
TSLA,Elon Musk's fortune briefly jumped to a record $500 billion,1759406590,Yahoo,https://finnhub.io/api/news?id=6ea56f177859bde5b6f9c24827695009e4b7a615b115cd3d0bd79ce5d13ba06b,positive
TSLA,"GraniteShares Announces Weekly Distributions for its YieldBOOST ETFs: COYY, TSYY, NVYY, XBTY, AMYY, TQQY, AZYY, YSPY, MTYY, PLYY, HOYY and SMYY",1759406400,Yahoo,https://finnhub.io/api/news?id=190f1ef752c52294542d53201af52c109ab6163f47e3c30d589fa6fe223a6292,neutral
TSLA,Dive into Digital Guizhou with Nattapong from Thailand,1759405560,Yahoo,https://finnhub.io/api/news?id=0e5038791bde39eb0c6748fb69bf13852e959ab601ba775f71ebe39803fc469c,neutral
TSLA,Energy Transition Update - Floating Offshore Wind Poised For Major Growth By 2030,1759405037,Yahoo,https://finnhub.io/api/news?id=586b46a8d8caebe3adf67c6c2b56477791e9a0cac3b19331d81484005ed472ed,positive
TSLA,Stocks Mostly Rise Pre-Bell as Traders Shrug Off Government Shutdown,1759404391,Yahoo,https://finnhub.io/api/news?id=78d33ac832866065c8601893b7af18f63b704d32bf9e9a540e8b0f6076aabb3c,negative
TSLA,"These Stocks Are Moving the Most Today: Tesla, Occidental, Fair Isaac, Experian, Fermi, Nvidia, and More",1759404060,Yahoo,https://finnhub.io/api/news?id=b57e892dbd96be2b0bf7c1d5d8667f5753456c74a325abba00fc48a8bf78cfc3,neutral
TSLA,Tesla: The Q3 Delivery Record Doesn't Change My Outlook,1759403579,SeekingAlpha,https://finnhub.io/api/news?id=e80ea8a0a48d95a5cc2d78cb6a8454f5b21f85e3dded8db3b4771275cb80813b,neutral
TSLA,Netflix Stock Slides Again. Elon Musk Is Still Slamming the Streamer.,1759402440,Yahoo,https://finnhub.io/api/news?id=c79b82ab942bf4a8393c85cae051b818ab8c52a0169a9e5e8a741cd3369617aa,negative
TSLA,"Tesla Sales, PMIs, Fed Speakers: Events and Data Still Expected This Week",1759402332,Yahoo,https://finnhub.io/api/news?id=3b2d9aa313dbf3d4fefa85e70fc248dcdc5df7a54c4a842255dae23a1413b677,neutral
TSLA,"Social Buzz: Wallstreetbets Stocks Mostly Higher Premarket Thursday; Advanced Micro Devices, Opendoor Technologies to Advance",1759402048,Yahoo,https://finnhub.io/api/news?id=316789e1363ab4dc93c8cf3c22a7c233a71900903939f2a502ee8ba246b1e4dd,positive
TSLA,Tesla's Sales Decline Expected to Slow in Delivery Report,1759401199,Yahoo,https://finnhub.io/api/news?id=e6e1f3346a4985166068c9734ede5fc774c3a47fe42a2be8be8a089f9bca40b8,negative
TSLA,"The ADP Report Says Layoffs Are Starting, Recession Is Near",1759400682,SeekingAlpha,https://finnhub.io/api/news?id=03625a8df59f40ba4618b70ede01380d7949b7922274093e4d8c2a62ef4a9c4c,negative
TSLA,"Stocks to Watch Thursday: Fair Isaac, Tesla, Fermi, Stellantis",1759400021,Yahoo,https://finnhub.io/api/news?id=bfaede7297e01ce0d424e54df76da62045d4c99840da5eb19265d7e10182064b,neutral
TSLA,Elon Musk halfway to becoming world's first trillionaire: report,1759376459,Yahoo,https://finnhub.io/api/news?id=395f211315efbc4292a0afb7b77b823413a7506b83fc03dae94a65f48d164082,neutral
TSLA,"Dow Jones Futures: Stock Market Hits Highs, Tesla Deliveries Due; Nvidia Partner Breaks Out",1759374114,Yahoo,https://finnhub.io/api/news?id=15436dc4ccae425e61b849d52f0d9a478a033863c22d02115296a9e7895b61c5,positive
TSLA,"Tesla deliveries, Fedspeak, mortgage rates: What to Watch",1759359615,Yahoo,https://finnhub.io/api/news?id=f05f87ea2287e2493543b61e47cbd32c9b58b44486e589d812af39b0639b6fef,neutral
TSLA,"EV sales to 'hit a speed bump,' but not fall off post-tax credit",1759354200,Yahoo,https://finnhub.io/api/news?id=3b8d8d1ccb6a691ebd70455ab381f6cae3e3315d4a174725317a37d481464857,positive
TSLA,Is GM the Best Automaker to Invest in Now?,1759352520,Yahoo,https://finnhub.io/api/news?id=7f36e4c8abc9eb84d9aa3649c77db8499cee4c70b7a021ef70f078a98514ce55,neutral
TSLA,Analyst Explains Why He Downgraded Tesla (TSLA) to Sell Ahead of Upcoming Earnings,1759350715,Yahoo,https://finnhub.io/api/news?id=4fdcb3bed911be43d90578cc71973ab0fe8ae377ddcfda15485d93856bc3a1d1,negative
TSLA,"BYD, NIO, Li Auto, and XPeng Post EV Sales Growth. Tesla Sales in China Haven’t Been Growing.",1759349820,Yahoo,https://finnhub.io/api/news?id=4ee6cb9e22b254dfd3a49392c473153032e3a3c84b7cc16737cb12762b332078,positive
TSLA,Tesla Stock Rockets Higher. Its Cars Just Got More Expensive.,1759349280,Yahoo,https://finnhub.io/api/news?id=3664cbbb153ec589502c6ac28663c2b17364e5c6f5b740bd6b04788e5d2779be,positive
TSLA,The IT Executive Tasked With Revamping How Tesla Sells Cars,1759348800,Yahoo,https://finnhub.io/api/news?id=b3051456b8202d06b7693fd355381e48602b3637fc003c610f290b6e7f888a69,neutral
TSLA,"Corteva plans spin-offs, Reddit reacts to drop in ChatGPT sourcing",1759347546,Yahoo,https://finnhub.io/api/news?id=cdc48dd9534a00b3755c3297db7fa1428b095158d0224898245b26d1bbd8d698,negative
TSLA,How Many Times Could You Fully Charge a Tesla for the Price of One Tesla Share?,1759340289,Yahoo,https://finnhub.io/api/news?id=21ba85da4fff5fa1cb7e0a55f6df6a9be4b1c4e243ea5ae777b26387494417d6,neutral
TSLA,Unusual Tesla Call Options Volume Shows Investors Bullish on TSLA,1759339802,Yahoo,https://finnhub.io/api/news?id=038b6bb1fcd942eacec7b8c20a425ead0f100366d70825812cee756119233a19,positive
TSLA,Taiwan Stuns Washington: Refuses US Demand to Make Half Its Chips,1759336297,Yahoo,https://finnhub.io/api/news?id=db10797aafb3457fcf35704c061e713c9588e507439eae219f0cedb82b9a3df1,negative
TSLA,Fermi IPO Is a Risky Bet on AI Power. The Stock Is Soaring in Its Debut.,1759335000,Yahoo,https://finnhub.io/api/news?id=1c907ac4a58b1ece24c0cc825659cb0a72ff90ee12503960883dc518c6daab3b,positive
TSLA,GM says Q3 sales rose 8% with record EV numbers,1759334606,Yahoo,https://finnhub.io/api/news?id=227330921d424c32b15a4290664cd8aaeb5dc6637de1fc0a9f555fd066b9d5c3,positive
TSLA,Tesla hikes lease prices as US electric vehicle tax credit expires,1759334425,Yahoo,https://finnhub.io/api/news?id=cca8b36d2110b80712a418c21ef1cf6736dabbbd7db802e0a7dde5293595a2e6,positive
TSLA,All Cap Investing With Kirk Spano,1759332000,SeekingAlpha,https://finnhub.io/api/news?id=8791af52a3096427d13adc649c16e421f787043433d1e4dd8f1271517ee62e03,neutral
TSLA,Tesla sales rise in parts of Europe amid pressure from rivals,1759331519,Yahoo,https://finnhub.io/api/news?id=6562f2bf3090ab7a6b3f0ac6fa5b011e0486f12bbf04ba943083b0d98e66bf51,positive
TSLA,Tesla CEO Musk's $1 Trillion Proposed Pay Package Opposed by New York Pension Fund,1759330322,Yahoo,https://finnhub.io/api/news?id=f70b3feb59150d8d460c9c10fe303dd87e69b02f33d4ab64bf3497b48ffaf4ee,negative
TSLA,Tesla's $1 Trillion AI Gamble Sends Stock Soaring--But Can Musk Deliver?,1759329928,Yahoo,https://finnhub.io/api/news?id=9dcadca6fe5fa29833b31f98b05a7e1759945add9c3386dbc9224b7acefc866a,neutral
TSLA,"Ford sales surge 8.2% in Q3, led by trucks and EVs",1759329648,Yahoo,https://finnhub.io/api/news?id=b94ceab59cda1daba8fec577b6c4d37ea06f82797a7a776717b86fb0c13e0f14,positive
TSLA,"Stocks to Watch Wednesday: Nike, Lithium Americas, Arm, Occidental",1759309518,Yahoo,https://finnhub.io/api/news?id=0c07d91dfc9d3e0294361190c520161e7d11d3f8d6816c7d27813c5f3214b964,neutral
TSLA,"NIO, Li Auto, and XPeng Post Sales Growth. Tesla Sales in China Haven’t Been Growing.",1759317480,Yahoo,https://finnhub.io/api/news?id=8fc6c78c5ed8b0e4af24ad1d66913fbf223eca12014323953cc95d192832084e,positive
TSLA,Tesla Stock Is Up. Its Cars Just Got More Expensive.,1759328040,Yahoo,https://finnhub.io/api/news?id=6f459444c1621421d389de1bcd255f89c06278743b4b1989c9f88c91391a5481,positive
TSLA,ADP Reports Surprise Job Loss As Government Shuts Down. Cue The Fed Rate Cuts.,1759327774,Yahoo,https://finnhub.io/api/news?id=f717935e39d7eedd077bed3e0b4d511197f31e4ec64dd15623b82b2ace695b7a,negative
TSLA,Netflix Stock Slides. Elon Musk Says He’s Canceling His Subscription.,1759326780,Yahoo,https://finnhub.io/api/news?id=c2d60db6830e226a073fd2733ed77f5752d85c4977dba82d4eb1abcc7ef1b5a8,negative
TSLA,William Blair: ’Increasingly difficult’ to like Tesla stock amid rich valuation,1759326502,Yahoo,https://finnhub.io/api/news?id=6a02e6133c6b3f72eea8ca14f8abd4807c6af881e150982634fa840e2307e2f7,neutral
TSLA,Ed Miliband tells Elon Musk to ‘get the hell out of our politics and our country’,1759323801,Yahoo,https://finnhub.io/api/news?id=fb814fa429e5aa053634165dd345ed7f55c59e180604e7dc1777f52897bee21d,neutral
TSLA,Latest News In Electric Vehicles - XPeng Achieves Record Vehicle Deliveries and Technological Milestones,1759322249,Yahoo,https://finnhub.io/api/news?id=303b5e1d86cb01c5957263df7bec345938920b290e9501a6969db67fc35c2ab5,positive
