ticker,headline,datetime,source,url,sentiment
AAPL,Bernstein ‘somewhat skeptical’ on rumors Intel will add AMD as a foundry customer,1759417523,Yahoo,https://finnhub.io/api/news?id=5692d3eb6577bcaba3d5d2e6a46d12f55385074a1fb31155ed1bc3972ccd577e,neutral
AAPL,"Nvidia, AMD Stocks Rise. What’s Driving the AI Chip Rally.",1759414980,Yahoo,https://finnhub.io/api/news?id=80a5527817a1989a38f7e89ade80b93c74b66cb6127f33fe009f913da8a816b6,neutral
AAPL,Coinbase exec Jesse Pollak on the coming Base token—and why we can trust the company’s blockchain,1759413600,Yahoo,https://finnhub.io/api/news?id=a0796a669e5e78a4994633b9b3190e7bf657428ed96018ddde42c05ec7ed0f64,neutral
AAPL,Apple Shifts Focus From Vision Pro to AI-Powered Smart Glasses,1759412038,Yahoo,https://finnhub.io/api/news?id=4770de92a568bc6ccec0c87ad96ba771f8b892b34c4e12dc8738566ee3d0f425,neutral
AAPL,Apple hardware ecosystem safe from AI smart glasses for next 2-3 years: analyst,1759410549,Yahoo,https://finnhub.io/api/news?id=00cc18e1336b7b2dda95e37488851a973dcbbc7db9014784b868c71e232bab31,positive
AAPL,Dr. Ronald Sugar and Gilman Louie join Ursa Major's Board of Directors,1759410000,Yahoo,https://finnhub.io/api/news?id=ed2ba17df53bd32a248ba9e2ab2e2e4c5e741a225a05b85903da79bc19ed8c19,neutral
AAPL,Andy Cunningham Joins Olatec Therapeutics Board of Directors,1759410000,Yahoo,https://finnhub.io/api/news?id=84b339ff1e855a2a0bee7dc60abad0921b0d8f238cdd9beffcb31608a527bc67,neutral
AAPL,"Elevated Materials Appoints Dr. Soonho Ahn to Board of Directors, Deepening Technical Leadership as Company Scales Advanced Battery Solutions",1759404600,Yahoo,https://finnhub.io/api/news?id=73c671d0e3af0f7bd2f0d9072b1c99f1b90374187aa4aaa0091b9c79fd464823,neutral
AAPL,"Nvidia, AMD Stocks Rise. How OpenAI Is Driving the AI Chip Rally.",1759404240,Yahoo,https://finnhub.io/api/news?id=6be929456ee8862c54d65cdb08bd960a942298b731251ecc8cc33c959cd3b688,neutral
AAPL,Apple target lifted at Morgan Stanley on stronger-than-expected iPhone 17 cycle,1759402527,Yahoo,https://finnhub.io/api/news?id=4423d4c3f6cfff360ccb4eea0a35c9467de9e4fed2234c7a029032c5f725c790,positive
AAPL,"Update: Market Chatter: Apple, OpenAI Request US Judge to Dismiss Lawsuit Filed by Elon Musk's xAI",1759399301,Yahoo,https://finnhub.io/api/news?id=9bae4327ff2f06d568d652394498f1d9b933dfc38972652ed03901bbcf9a6e66,negative
AAPL,Bitcoin price hits two-month high amid US shutdown,1759396503,Yahoo,https://finnhub.io/api/news?id=5ceac3b1905cfdccaa0d53ba36e20ceec8bfc558b88fa90d557bf5b596a8fc45,positive
AAPL,"Zacks Investment Ideas feature highlights: Apple, Alphabet and Microsoft",1759395300,Yahoo,https://finnhub.io/api/news?id=d69a9fbe1f591cfc0fc0a7ab5859a24deb32d3bac9244c66d268c073a808a47a,neutral
AAPL,FTSE 100 LIVE: Stocks push higher despite eurozone unemployment rising to 6.3%,1759393105,Yahoo,https://finnhub.io/api/news?id=695c84833c251823b0f1b3822db818735577d4fa437ba26b570dcdba31f63a6b,positive
AAPL,"SCHD: If You're Considering Selling, Buy QDVO Instead",1759386600,SeekingAlpha,https://finnhub.io/api/news?id=90462e3cb84e6fbd454dc8a373fb57ed8b92c41ddbd5514290b867c60aa67782,neutral
AAPL,Jim Cramer Says Apple “Has 1.5 billion Users Who Want a Chatbot Built In”,1759386012,Yahoo,https://finnhub.io/api/news?id=76ada99fc69ea9acd26cfb43b0557da321775ccfb024c23eff610a129970b0be,neutral
AAPL,When 'job hugging' is a good idea — and when it holds you back,1759381231,Yahoo,https://finnhub.io/api/news?id=b9694f511d9216f64ca2c45a18943f515a7723714870a8514a352e85aa69400a,neutral
AAPL,Apple shelves Vision Pro revamp in pursuit of AI glasses to rival Meta - Bloomberg,1759357466,Yahoo,https://finnhub.io/api/news?id=5fc830052eb373cb20a81312e8b68452a461e0aafa5fd2036af9f5d1406117fe,neutral
AAPL,"Apple pulled off a quiet rebound, but here’s the lever many missed",1759356420,Yahoo,https://finnhub.io/api/news?id=6c8b6dd8cf994b83c2ef7d9d6ecb85f264f6bc89de90d2e0178ad27a74ccc115,neutral
AAPL,"Apple halts Vision Pro overhaul to focus on AI glasses, Bloomberg News reports",1759354903,Yahoo,https://finnhub.io/api/news?id=e51bd58ad33b8acee9828e3acc000f389df47fb4de2557762cce9db63c924a48,negative
AAPL,Alphabet Gains Cloud Momentum and Positive Outlook Following Favorable Court Ruling,1759352824,Yahoo,https://finnhub.io/api/news?id=3a940dc5abcc40022b338eea89053060ffc1f622d247cd186c358b57d186924f,positive
AAPL,OpenAI Is Breaking New Ground With Sora. Why the AI Video App Is Bad News for Meta.,1759348620,Yahoo,https://finnhub.io/api/news?id=ddb7f3b5570e300c7153cd0cea5c9f82ba94e80224165c2e59e27c0d3ff1d363,negative
AAPL,"iPhone 17 Outsells On Speed, Not AI Hype: Analyst",1759344156,Yahoo,https://finnhub.io/api/news?id=0c2ba68c45e3d68f18d8c4779b54734169d01a23651044b0d7f74f41f2bb446c,neutral
AAPL,Intel spikes on reports of potential AMD manufacturing deal,1759343857,Yahoo,https://finnhub.io/api/news?id=1d5fb7d6b206d9e1bd8a4f1067c59e78c68dd47fc0dafb165e609cef78d54557,negative
AAPL,Peloton Slides After Hiking Prices in Sweeping Product Revamp,1759343839,Yahoo,https://finnhub.io/api/news?id=c9ba05949f30fc83fb9be4b90ba03216e6df193ff2fd68cbb138f4bcbc6034e7,negative
AAPL,"Qualcomm Prevails Over Arm in Court. Next, an Appeal.",1759333860,Yahoo,https://finnhub.io/api/news?id=fc647d95539e822708e2dbcc49d02a4c81f2d1aadb279b0060a00d6eb371296e,neutral
AAPL,AT&T Stock Gets a Downgrade. Why ‘Free’ iPhones Are Partly to Blame.,1759342440,Yahoo,https://finnhub.io/api/news?id=f1432a6ef8acf344c139d3a6a7bd079faaf963d56966ac6fb848fac608b5951a,negative
AAPL,Is Apple Stock About to Breakout?,1759341540,Yahoo,https://finnhub.io/api/news?id=15837729edb1d12bcbbe02dd9dca4aad7c7aefbd5ce31d09cbb1ea9e3eb3b269,neutral
AAPL,"Wall Street Logs Best Q3 Since 2020, Dow Hits Record",1759335492,Yahoo,https://finnhub.io/api/news?id=681456b0a3c715b6a1a55c4d5e4b9049cd3cd9632fb6890d9d70cfd0ae637d22,positive
AAPL,Will Apple (AAPL) Beat Estimates Again in Its Next Earnings Report?,1759335004,Yahoo,https://finnhub.io/api/news?id=365566d431a77c00ca2d595fdd5ec7ada00d7a1b04da1252512c27293cd1cfe3,positive
AAPL,"TON Foundation Brings Former Nike, Apple Exec as Marketing Chief",1759334000,Yahoo,https://finnhub.io/api/news?id=7e60319562872a8f7265f9414201649bf286fb63d970ab795bfe73180a94578a,neutral
AAPL,All Cap Investing With Kirk Spano,1759332000,SeekingAlpha,https://finnhub.io/api/news?id=8791af52a3096427d13adc649c16e421f787043433d1e4dd8f1271517ee62e03,neutral
AAPL,Warren Buffett's Berkshire Hathaway Could Be Closing in on $10B Deal With Occidental Petroleum,1759331939,Yahoo,https://finnhub.io/api/news?id=864df8b7bfece497c386bd23a7fd6488e2b3a00c9e35555847ad1f29425ef6e2,neutral
AAPL,Apple Stock Gets a New Buy Rating. How the iPhone 17 Can Help Shares Climb 20%.,1759331040,Yahoo,https://finnhub.io/api/news?id=feab127c17cfd16fa05885f0fab5600f7cae8684b4abd809bc1fba6bb328e717,positive
AAPL,"Peloton Unveils AI Coaching, New Machines To Boost Sales",1759330221,Yahoo,https://finnhub.io/api/news?id=71d6ec6a2f0bb14a0de7df93ec6ae5920e5ac4c969320e290747ce9bf609a9cd,positive
AAPL,CoreWeave Is Winning Over Wall Street Amid Flurry of New Deals,1759327806,Yahoo,https://finnhub.io/api/news?id=9912108a1a1d79fd4800f8f4cd2de6c8376a85c1dbd342dfdcf53641dfb7a7f8,positive
AAPL,Intel's Comeback Is Just Getting Started (Rating Upgrade),1759326539,SeekingAlpha,https://finnhub.io/api/news?id=4e57297b42a5a72224193b0a0275c4c00eaa82b0d953fd0686424668f71216f2,neutral
AAPL,"Apple initiated, DraftKings downgraded: Wall Street's top analyst calls",1759326287,Yahoo,https://finnhub.io/api/news?id=d04847c80129ee64674b43c6cacf02f659e0b2b4cecc1558063d0fc2cd07a3ad,neutral
AAPL,"Exclusive: Qualcomm shifts chips to newer Arm tech as competition with Apple, MediaTek heats up",1759323630,Yahoo,https://finnhub.io/api/news?id=a99f15302f445c572226936a9c9762ae54ccb41bcac7a8fd71ce709d5baae523,neutral
AAPL,These 2 Computer and Technology Stocks Could Beat Earnings: Why They Should Be on Your Radar,1759323604,Yahoo,https://finnhub.io/api/news?id=dd64b3e7fcbfdcbc5bfe4c4672727630b20edaa6859d0ff23623951bb11ed26f,neutral
AAPL,‘2 Out of 3 Ain’t Bad’ When It Comes to Charting the S&P 500’s Top 3 Stocks,1759322701,Yahoo,https://finnhub.io/api/news?id=a919acd0085579d41906705d1c1bbde1191ccaec8226aaf2e45588655edbf54a,neutral
AAPL,"Is the AI bubble about to burst? Think again, say these analysts",1759322604,Yahoo,https://finnhub.io/api/news?id=0f7f87e5e781fab506e4316881dcf2e66f89255706aadcfc3359fdf11a19efcc,neutral
AAPL,"Apple, OpenAI Seek Dismissal of Musk's xAI Antitrust Lawsuit",1759322431,Yahoo,https://finnhub.io/api/news?id=226c5189b23707cda916b737f645c44efef7e2e61ef6893733b8888954a572bb,negative
AAPL,Co-Founder and Former CEO of Google-Acquired Nik Software Joins CEO Coaching International as Partner and Coach,1759322100,Yahoo,https://finnhub.io/api/news?id=ff39174a6f3abb1c746bbfd00002e3cdb521d0763fcec14b5677d66293300b33,neutral
AAPL,Parks Associates: Amazon Smart Speakers now Account for 60% of all Smart Speaker Purchases,1759320480,Yahoo,https://finnhub.io/api/news?id=f260433021190a841e81569a1a933de18997f9769c178824f979a18e03488b49,neutral
AAPL,What Is 1 of the Best Semiconductor Stocks to Buy Now?,1759320000,Yahoo,https://finnhub.io/api/news?id=0ea977df58bc932e4c2af871bf86e7e998ca28270b3afd65a5135cb150ebae3e,neutral
AAPL,"Market Chatter: Apple, Microsoft's OpenAI, Request US Judge to Dismiss Lawsuit Filed by Elon Musk's xAI",1759316935,Yahoo,https://finnhub.io/api/news?id=a19dbb4e2f041286cab7c43d49abb97d689a250ac736c589170b8e6e52a5b48f,negative
AAPL,How to check if you were a premium bonds prize winner in October's draw,1759316666,Yahoo,https://finnhub.io/api/news?id=e299dca2b3c815ebf80719e3577ba83fc7e550683aab37d04ba24b261f6bf760,neutral
AAPL,"Ford CEO says customers are not interested in $75,000 EVs",1759316419,Yahoo,https://finnhub.io/api/news?id=94f4426a67960aa6008c09bfed54a578e70214ed378fa82545f07cf423291f2a,neutral
AAPL,Where Will Apple Be in 1 Year?,1759316400,Yahoo,https://finnhub.io/api/news?id=269586c767fbfb474cf5cef9dbe2702ced56b9723aa6a338ec73e42c472bacef,neutral
AAPL,"Shutdown, Tariffs, Pharma Pricing Make for a Busy Start to the Quarter. What Matters.",1759315560,Yahoo,https://finnhub.io/api/news?id=679aa07169de322d890affea1de51fc08127a1733177b788612c3e7001acf769,neutral
AAPL,Better AI Dividend Stock: Apple vs. Broadcom,1759311300,Yahoo,https://finnhub.io/api/news?id=1f2e72915e52e689eced53f5299944cdc37a4a7554f43dd77b4a2a6de31a15e4,positive
AAPL,This ETF Has Beaten Every Stock in the Magnificent Seven This Year. Is It Too Late to Buy?,1759311000,Yahoo,https://finnhub.io/api/news?id=4f15f790c8378ed52c410bd25890d55f1e53d0eae62d5a1f6b49e46c71da4fa3,neutral
AAPL,"AI PC Research Report 2025-2035: Market to Reach $992 Billion by 2035 at a CAGR of 32.16%, Driven by NVIDIA, Apple, AMD, Lenovo, Microsoft, Dell, HP, Fujitsu, ASUSTeK, Intel, and Huawei",1759310160,Yahoo,https://finnhub.io/api/news?id=18e9deae056f8d2482a35b6a2c1e99686575aae049cfad4e1838f08415e4d05b,positive
AAPL,Epic Games says Apple’s new install process cuts user drop-offs by 60%,1759309200,Yahoo,https://finnhub.io/api/news?id=bea9f2ed47b2d2a2a5a372a30a94bca65fd1304431a7b0b485185b52645eef9c,positive
AAPL,"PU Prime Launches Halloween Giveaway: iPhones, Watches & Cash Await",1759307640,Yahoo,https://finnhub.io/api/news?id=48bf6850aca0114e90e442eea5e9b410ee942c52c88321e329835d6bced85b0e,neutral
AAPL,FTSE 100 LIVE: London hits record high as global stocks cheer best September since 2013,1759306801,Yahoo,https://finnhub.io/api/news?id=347527ced929b17925ac29a22d9b965764c7119974ae263d51cba24598811a34,positive
AAPL,"2 ""Magnificent Seven"" Stocks to Buy Hand Over Fist in October",1759306020,Yahoo,https://finnhub.io/api/news?id=aa9096576b4735b84c45ed06e4ef3db80c7f273a4b73365a41424976f72d15dc,neutral
AAPL,"Zacks Investment Ideas feature highlights: Amazon, Apple, Nvidia and Meta",1759303560,Yahoo,https://finnhub.io/api/news?id=25ddd38dc13fe0ad272e78c5c605c44da38efa3f396d6cb7d36f7dfe8cdac851,neutral
AAPL,UK house prices creep up amid fading interest rate cut expectations,1759300878,Yahoo,https://finnhub.io/api/news?id=0e3ca851204e26048256c1f30513ce7feb3b2e6acd947c6792db0729f8be81f1,positive
AAPL,"Apple Developing ‘Veritas’ Internal AI Chatbot to Test Revamped Siri, Underlying LLM System",1759299386,Yahoo,https://finnhub.io/api/news?id=ff16c51368bb4654fc78a76f62c8f85c76c4782bf757a44929ed506b521400f6,neutral
AAPL,"Meta to Launch Ad-Free Subscription Option for Facebook, Instagram in the UK",1759299382,Yahoo,https://finnhub.io/api/news?id=e88070c504718ffd6df68dd4af29b5e6308f523559c9a46898fdb5beaed5b133,neutral
AAPL,Telegram To Let Users Trade Tokenized US Stocks via Wallet Starting October,1759298536,Yahoo,https://finnhub.io/api/news?id=cb47e1d9b5a9b4ec0b5978d268f5fae73531ee016ef9ce276f563a2849a14ef5,neutral
AAPL,"Spotify founder Daniel Ek's next act: long bets in European defence, health",1759294869,Yahoo,https://finnhub.io/api/news?id=7172ebeef56fbede1102be8223a0809deb09b500fadb74407f1b83b2b1d7925e,neutral
AAPL,"Why Analysts Expect Intel (INTC) Stock to Rise on Headlines, Not Fundamentals",1759282303,Yahoo,https://finnhub.io/api/news?id=b796c873c58aa7a91be36194a278be82c005d6a0410ca04f94f130f891577421,neutral
AAPL,BofA Reiterates Apple (AAPL) Buy Rating with $270 Target as Carrier Incentives Drive iPhone 17 Demand,1759281723,Yahoo,https://finnhub.io/api/news?id=8c590cbb20342689076c3262591a236c9056ff10725f522b90ec792db1fa5f00,neutral
AAPL,Buffett’s Berkshire Nears Deal to Buy OxyChem for $10 Billion,1759272964,Yahoo,https://finnhub.io/api/news?id=9b896f75b09a40b1e86e2ee14defffb3d44136d339934194bb2b5389c5cb5748,neutral
AAPL,Pixalate Exposes Widespread COPPA Violations in New Report: 99% of U.S.-Registered Apple App and Google Play Store Likely Child-Directed Apps Fail to Obtain Required Verifiable Parental Consent (VPC); Personal Info Shared in Ad Bid Stream,1759250400,Yahoo,https://finnhub.io/api/news?id=4ffe99b874224df5fba4129eae0899dbcb0540675565027ffadad009d38d1973,negative
AAPL,"Apple, Warner Bros. Discovery, Celsius: Top Analyst Calls",1759246576,Yahoo,https://finnhub.io/api/news?id=c8264d2d9f6b7c0ef75b4f7172184e8fe1a9b5eb5770beea1c14d285d67f6273,neutral
AAPL,"Don't Fear AI Bubble, There Will Be Winners - Tech Contrarians",1759244700,SeekingAlpha,https://finnhub.io/api/news?id=58d9aaaca47d8b88156dad7f0db721bb33b7ec62dfa9956c05ea755a691e09c6,neutral
AAPL,Apple Inc. (AAPL): A Bear Case Theory,1759243020,Yahoo,https://finnhub.io/api/news?id=815c9135fc8a75a3690b8f59ba159f1493e83b297d437ff8502c90b5ff43251b,neutral
AAPL,Logitech Targets Hybrid Work Needs With Zone Wireless 2 Launch,1759242600,Yahoo,https://finnhub.io/api/news?id=8385582b0fbe8ccb56a147ed91690f6b897e453945bc5984318d7914997270b6,neutral
AAPL,Cash Flow + Capital Gains: 3 Tech Stocks That Do Both,1759240869,Yahoo,https://finnhub.io/api/news?id=615d4ea9f96a77a38e20772ddc144a49c12ad9fd1a77b74f98cf64c6fef9b4e3,neutral
AAPL,Research Shows 3 Keys to Big Tech's Success that Companies Can Implement Now,1759240680,Yahoo,https://finnhub.io/api/news?id=38c8153dcb1760a410a3f5119c25f4ec6737ab9e4a4a4f8bc89860da6725cc1b,positive
AAPL,Latest News In Cloud AI - Cloud Security Transformed by AI-Driven Innovations,1759235887,Yahoo,https://finnhub.io/api/news?id=42823d1c372cd97121d410944fee66b9d7e66d2ff1e5ff115ea97fc443f13ad5,neutral
AAPL,AAPL: Apple Stock Wobbles as iPhone 17 Demand Cools In U.S. Market,1759234681,Yahoo,https://finnhub.io/api/news?id=9a09cad3c86f5bc700482b430c9c7a1f0ebda5393c5a16f85811398a71d78eeb,negative
AAPL,Is Growth Stalling for MP Materials Investors?,1759234500,Yahoo,https://finnhub.io/api/news?id=2e973b1a1c22d427a77d7a0d7476d4192bbe36dbc5f4e13898e56a1efa2f1fa1,negative
AAPL,Let's Talk About SCHD And Its Miserable 5-Year Track Record,1759231723,SeekingAlpha,https://finnhub.io/api/news?id=db2834ac2e2eda58fe172c9ffeb654ea0b9eefc6a8a413ef244eab18d6f36cee,negative
AAPL,"Alphabet: My Thesis Played Out, Now It's Time For Caution (Rating Downgrade)",1759228922,SeekingAlpha,https://finnhub.io/api/news?id=bf54c9188e0182ae31df19c2d2a8ba7e05c68453ba05669d42c4fdafce936c37,neutral
AAPL,"Smart Virtual Assistant Market Forecasts Report 2025-2030: Alphabet, Apple, Amazon, Microsoft and Samsung Drive Growth Through R&D, Product Launches and Partnerships",1759228860,Yahoo,https://finnhub.io/api/news?id=03e1f3a6f8962512a9ccbe2cb716e3cc498f9651f5840eb15bbfe371f289a38d,positive
AAPL,Beyond Nvidia: How to spot the next AI breakout for your portfolio,1759226455,Yahoo,https://finnhub.io/api/news?id=e84c84813b3003d10167f7aa0c5d828b6e65a4d144fbaed18e2ecca70fcb5981,neutral
AAPL,"For data center contracts, it’s all about the fine print",1759224240,Yahoo,https://finnhub.io/api/news?id=b734f1f903a38c17c2ef65eb01846d7514686ab16a2eaf2e3bcd780f05b10e3f,neutral
AAPL,"These 2 Top Dividend Stocks Are Finally Rebounding, and There Might Be More Upside Ahead",1759220100,Yahoo,https://finnhub.io/api/news?id=ac14a3ddb5a2f4a8ce65c4eab1c1ec48cf7f6727d4d301b33068a3a0d2dc0080,positive
AAPL,"UK economic growth slowed between April and June, ONS confirms",1759216321,Yahoo,https://finnhub.io/api/news?id=32e6236c4b408ac7ac702d6faadc9a36ea6938b2471eda6ddd27cc333a6e1af0,negative
AAPL,Prediction: This Artificial Intelligence (AI) Stock Will Be the Next Apple of the 2030s,1759216200,Yahoo,https://finnhub.io/api/news?id=3e66d2a78b0b37283ae05ca5ca6bbc97efd94944241621b7223ad6b74b9b87e3,neutral
AAPL,"Amazon, Apple, Meta probed by Senate panel over H-1B visa hiring",1759212000,Yahoo,https://finnhub.io/api/news?id=70efa46773da664c066e7b3ad8c7759a4af3c7e06bef7e28602cff65ffead107,negative
AAPL,Apple (AAPL) Reiterated Sector Weight by KeyBanc on Mixed iPhone 17 Demand,1759209891,Yahoo,https://finnhub.io/api/news?id=7c0734fc8fe90c427b8826f110639e5c251c1fc03be75e770869f71de574762a,positive
AAPL,DIY and gardening products help drive shop price inflation to 1.4%,1759208425,Yahoo,https://finnhub.io/api/news?id=2b360dac7379c50c924ed199122fc5177654f36e6ce100bfd8122cb326fccae4,positive
AAPL,Apple is falling out of love with Labour’s Britain,1759208400,Yahoo,https://finnhub.io/api/news?id=19902808c9dda127832c23a1171057d24ab8852e25b096a34d861b334dfb4d62,negative
AAPL,Grab Holdings Is Cheaper Than It Looks,1759190573,SeekingAlpha,https://finnhub.io/api/news?id=5f046ad1880cb2e3fb45625b5bfae1b1a892d3b17e4542921ab192a9b241997e,neutral
AAPL,Will Amazon Stock Keep Rebounding This Year?,1759188480,Yahoo,https://finnhub.io/api/news?id=d4c5391ff8950a088af5885dc9a8d2e6669f8d15937320806f063826ebf4f44a,positive
AAPL,Intel Corp. (INTC) Jumps 20% as Firm Courts Apple Inc.,1759185709,Yahoo,https://finnhub.io/api/news?id=1d318e5e8a4dc1fb72df202ff7478af9690bae3faa995335892ed76ac41b4e88,positive
AAPL,Jim Cramer Does’t Think Reports Of Intel (INTC) Asking Apple For Investment Are Serious,1759182932,Yahoo,https://finnhub.io/api/news?id=4bbb6554c15972a2fde49dc530fb80813744aa52ed2572aa61fefff4b2872b85,neutral
AAPL,Microsoft: What Changed My Mind,1759174682,SeekingAlpha,https://finnhub.io/api/news?id=c70d35c6a9bb1a91f807dcbf1860630e2d9a3ac5b076ecca307150ee9f8696fe,neutral
AAPL,Apple Momentum Slows as Jefferies Reiterates Hold at $206,1759165343,Yahoo,https://finnhub.io/api/news?id=e45aad1f446abf03611dfe21661514cee2364bf53e3b077a4c517adc7fe4239e,negative
AAPL,"Anthropic launches Claude Sonnet 4.5, its best AI model for coding",1759165334,Yahoo,https://finnhub.io/api/news?id=11673fdda56ed9abe8ef2d86bf72d528cff0736ff407262971a713a2fa833ff7,positive
AAPL,S&P 500 Keeps Grinding Higher,1759163733,Yahoo,https://finnhub.io/api/news?id=c0f7c539d325245101606bd1358f445247ed35c4c910cbf6dce5c47529755d75,negative
AAPL,Amazon Stock Is Underperforming Badly in 2025. What It Needs in Q4.,1759162001,Yahoo,https://finnhub.io/api/news?id=b9c55dbc2d7bcb28986673aed7283320145b8c00f7b4c3bd88c2c7273a0aecd2,neutral
AAPL,3 High-Conviction Picks I Just Bought More Of For Our Dividend Portfolio,1759161600,SeekingAlpha,https://finnhub.io/api/news?id=66296fdb373ff36f98cd753d8fb650629ac3c83d52a7f5f29a15c61fe1f11206,neutral
AAPL,Meet the rich retired boomers who are now ultra-frugal because they are scared of going broke—even after saving for decades,1759160702,Yahoo,https://finnhub.io/api/news?id=a983c0f27cf2203871d060cb9825cbf6825e586084610a475a742a7a2f42f02e,neutral
AAPL,The Dow Is Down. Tech Is Carrying the S&P 500 and Nasdaq.,1759158984,Yahoo,https://finnhub.io/api/news?id=f0a26a77d0a9fe6fd3143b2b94f031c87ca827e3af4764e881b8f5c38d6993fd,negative
AAPL,Apple Just Unveiled the iPhone 17: Here’s What This Means for You If You Own Stock,1759158014,Yahoo,https://finnhub.io/api/news?id=6f848932f35474fb9ba6969cff835dae10e65c23ddaa3c90f881b83a769e8299,neutral
AAPL,Qualcomm: The Market Is Proving Me Wrong (Upgrade),1759157933,SeekingAlpha,https://finnhub.io/api/news?id=dd01f9f2d6fc76a5223cc821a7d58e5f88a1aa8b730490cc8547c90765938dca,neutral
AAPL,Apple Stock Is on a Roll. But This Data Show iPhone 17 Sales Losing Momentum.,1759156080,Yahoo,https://finnhub.io/api/news?id=6757741f265514154bd1cbcd1d7017b2e3ac986c5d01161b55403244d38510fc,negative
AAPL,Can Apple Stock Hit $310 in 2025?,1759155243,Yahoo,https://finnhub.io/api/news?id=d8b2fd619bb06d8a45e30cbb66f99473b876cc4824d87ef4a82539faee71d00d,neutral
AAPL,Watch These Intel Price Levels After Stock Surged 20% Last Week,1759152877,Yahoo,https://finnhub.io/api/news?id=fc7042ea16833c19d2d2cb0ccde117a8916e532020522effeb740064a2dffb09,neutral
AAPL,Timing The Bubble Top: Circular Spending And Powell's Warning,1759151675,SeekingAlpha,https://finnhub.io/api/news?id=5a1d877dbfbb279285bdabe58ff1d604adebd1fcd8baa23d229ad72a1bf67b0b,neutral
AAPL,Analyst on Apple (AAPL) After iPhone 17 Launch: AI ‘Still a Problem’ But Company Has ‘Shifted the Story’,1759151063,Yahoo,https://finnhub.io/api/news?id=f085874f7a0d56896b1a01b607ed7577588ef6d79de69bb91085ad661a2fa853,negative
AAPL,Analyst Says He’s Turned Bullish on Tesla (TSLA) Despite Weak Auto Business – Here’s Why,1759150997,Yahoo,https://finnhub.io/api/news?id=ae6ecf80964f4ac11ee52a12dc9776e9af9741f142506ccdce5a70631ef93bc3,negative
AAPL,Should Rachel Reeves hike taxes or cut benefit spending in budget? Have your say,1759150864,Yahoo,https://finnhub.io/api/news?id=c80877e37a41692e74f8f3efd566dcfa2dc926554d842b970e33d3de68d84234,neutral
AAPL,These are the key milestones for the S&P 500 rally to continue,1759149609,Yahoo,https://finnhub.io/api/news?id=805557850d0be1886975f5daf4bf738c3bef8a665f755ee85b6a362058d7ca1c,neutral
AAPL,"How the Fed is juicing the markets, from share buybacks to AI bets",1759140015,Yahoo,https://finnhub.io/api/news?id=c369ad50ce40ea4c58bc41d4218074b7789d957121545122622e98b3e6eab892,neutral
AAPL,Best-Performing Leveraged ETFs of Last Week,1759140000,Yahoo,https://finnhub.io/api/news?id=161a67a4cb42b20c2917e49f248b388b1c07303c8a0e64cb81915c660912d7ba,positive
AAPL,Big Tech's Circular Financing Is A Concern,1759139213,SeekingAlpha,https://finnhub.io/api/news?id=789ad13a7b8e30bfae49e06514f62fd7332a37f00b6b2afa9dd39e79222480c5,neutral
AAPL,Apple: No Inflection Point In AI Monetization (Rating Downgrade),1759138292,SeekingAlpha,https://finnhub.io/api/news?id=0c4553430ba36ddf17d7803e8f4b8b932a0edb86d2e4def8654792e638d8bd0d,neutral
AAPL,"Chinese display manufacturing giant BOE makes foray into robotics, AI software",1759138200,Yahoo,https://finnhub.io/api/news?id=36266ec651cc104e37988afd4544d58823243c37cc79c04b2c2ce724441b05c4,neutral
AAPL,AI emissions putting Big Tech’s 2030 emissions targets at risk,1759137021,Yahoo,https://finnhub.io/api/news?id=0f4515151d712c7cc787241e23a2c14ec48decea9de3be555e69ec399a99879c,negative
AAPL,BIEL Crystal provides high-end glass cover for iPhone 17 series,1759136940,Yahoo,https://finnhub.io/api/news?id=cba047b2cea27b69c207f93a9fe02078b0dee241c973af5b71453fc0ea0044ac,neutral
AAPL,"Taiwan Must Help US to Make Half Its Chips, Commerce Chief Says",1759134174,Yahoo,https://finnhub.io/api/news?id=60ea6ca4c46083ff190f5e399c2125dacffce92b577d9fb9969018ae573c1efe,neutral
AAPL,QUALCOMM Incorporated (QCOM) Announces New Chips for PC’s and Phones,1759124377,Yahoo,https://finnhub.io/api/news?id=357229b0073d90a49dccd2ecff623c5240f8d6cbd4fbc58adf16fef8a5724621,positive
AAPL,Jim Cramer highlights Apple’s Massive Resources,1759123302,Yahoo,https://finnhub.io/api/news?id=4cb351313e99288389c28688ddd502466159fcae837a5c2fad43fe55919ad5dc,neutral
AAPL,Jim Cramer Says “Intel Can’t Be Allowed to Fail”,1759123300,Yahoo,https://finnhub.io/api/news?id=8653efaeebb6c83e3ae51790bcc479a6e888879ef58c4d01c0362be53fb5e835,neutral
AAPL,1 Growth Stock to Stash and 2 Facing Headwinds,1759120341,Yahoo,https://finnhub.io/api/news?id=1e1f08baf1c7a3a0d1ed742dcfeb62be46365ba0a59b512873c0a5ac5bd9c9e6,negative
AAPL,Prediction: Apple Will Stage a Major Comeback in the Next 5 Years. Here's 1 Reason Why.,1759107900,Yahoo,https://finnhub.io/api/news?id=b10f0bd0a437e33c7a073db6c2a689054bf17db9040118cecdd0fb2b3608cb86,neutral
AAPL,"Solana Co-Founder Says '50/50' Chance Quantum Computing Breaks Bitcoin By 2030, Calls For Quick Action",1759107676,Yahoo,https://finnhub.io/api/news?id=b0681c9b3058c597e4b41aa421c66e96a434c0b9724f96827af910690fc5e764,neutral
NVDA,"Dow Jones Futures Loom, Palantir Looks To Rebound; More Big Tesla News Due",1759696112,Yahoo,https://finnhub.io/api/news?id=039541b889ccea3606df7c676671362ca0a41db808272c0cbca257c82eaa55fb,positive
NVDA,Why Intel Rallied in September,1759687440,Yahoo,https://finnhub.io/api/news?id=a6bd7c62f9264ddbb6bf578b9865375924b937765f7d183a10f1c443b3b2afcd,neutral
NVDA,4 Best Artificial Intelligence (AI) Stocks to Buy in October,1759680000,Yahoo,https://finnhub.io/api/news?id=34f9233801376869c4484964d75a56156784469a7ce33e4897a238ee072c329a,neutral
NVDA,"Analyst on NVIDIA (NVDA): ‘Eventually, We Will Hit a Wall’",1759673743,Yahoo,https://finnhub.io/api/news?id=89c126c677985ffdf0f943b5b28a796d14c456cbed20236e04605a020cfbba32,neutral
