ticker,headline,datetime,source,url,sentiment
NVDA,"Wall Street, crypto industry say tokenization will reshape global markets: 'It’s going to eat the entire financial system'",1759671005,Yahoo,https://finnhub.io/api/news?id=bc3d53bf653acf166de547edf6082268739be3ae72c5a6fd554f90ee2bff63f2,negative
NVDA,Why tariffs should overtake government shutdown as your biggest investing concern,1759667432,Yahoo,https://finnhub.io/api/news?id=43f6bf543e5aa1b69490a850eb3bfbd7f39b4fe67f7b0d5123c5b11663345897,neutral
NVDA,2 No-Brainer Artificial Intelligence (AI) Stocks to Buy Right Now,1759665900,Yahoo,https://finnhub.io/api/news?id=c9936f9b5c3255171ce48fbca9b60812229647c130cb2c58c43e35d490109c38,neutral
NVDA,Prediction: This Artificial Intelligence (AI) Stock Could Power the Next Generation of EVs,1759664340,Yahoo,https://finnhub.io/api/news?id=03bdc3c50f1b97abfb844aeb028d2016b37937a3852699fdced8a578dc95ee63,neutral
NVDA,Semiconductors Winners And Losers At The Start Of Q4 2025,1759663316,SeekingAlpha,https://finnhub.io/api/news?id=b8361a82f85baa9f0f2047b676225342bcf4879eb744eddb7ae031e9b0a59689,neutral
NVDA,Why Micron Stock Exploded 40% Higher in September,1759663200,Yahoo,https://finnhub.io/api/news?id=d3a48acfe1df62ceaae8f50d21e52afb342fbfb1ce2023156bae872cc76f72c1,positive
NVDA,Nvidia vs. Microsoft: Which Stock Is the Better Buy After Their OpenAI Investments?,1759662900,Yahoo,https://finnhub.io/api/news?id=6b6f557d9a4e19ae017e6317923ff5ae0044e23e741a992b01520ff8d3ec5c96,neutral
NVDA,CoreWeave's $6.3 Billion Backstop Deal With Nvidia: What It Means for Each Company,1759660200,Yahoo,https://finnhub.io/api/news?id=9a641d9fbdb03164c9257cf11f1fd89dad7dd32c00313a41f0b75c0d6eabb950,neutral
NVDA,3 Top Quantum Computing Stocks to Buy in October,1759658400,Yahoo,https://finnhub.io/api/news?id=46438408661446e329517816d478250754bc45abe53ade1b7711cb495f2e8c60,neutral
NVDA,UiPath Stock Jumps on Collaboration With Nvidia and Others. Is It Time to Buy the Stock?,1759655880,Yahoo,https://finnhub.io/api/news?id=d95fb01ddc9d3564a818a0b7609a69d1b7d382e36f8c39d6905300509042393c,neutral
NVDA,Is CoreWeave a Better Investment Than Nvidia?,1759655700,Yahoo,https://finnhub.io/api/news?id=86e2127051f9bb14baf2da40d94370fb8a5a442537cb89a0c1866b7efb35abe3,neutral
NVDA,AI Spending Could Reach $4 Trillion by 2030. Here Are 3 Must-Own Stocks if It Does.,1759654800,Yahoo,https://finnhub.io/api/news?id=2d51742bcd188b9da2440741cf1599e0071bd71539d79769cc646a5dc72d780f,neutral
NVDA,"ETG: A Consistent Income Payer With Global Equity Exposure, 7.3% Yield",1759652100,SeekingAlpha,https://finnhub.io/api/news?id=d29cd9bedca08a001951cba20c068db9c4483337cd90451b6ff4fed78c2a0ab4,positive
NVDA,3 Tech Stocks With More Potential Than Any Cryptocurrency,1759651320,Yahoo,https://finnhub.io/api/news?id=7fe8dd11f0a46f061cfc357cb24471b879bc4c99951ee380c5ec6cbf9afd5fb3,neutral
NVDA,"While Nvidia and SoftBank Invest Billions in Intel, You Should Consider Buying This Rival Semiconductor Stock Instead",1759650900,Yahoo,https://finnhub.io/api/news?id=3c2d9d800ef5f3fc4805ab03e508c4c4f72bdfef264fb29993cf87fb2093ffd9,neutral
NVDA,Nvidia Partner Hon Hai Meets Sales Estimates on Strong AI Demand,1759650745,Yahoo,https://finnhub.io/api/news?id=37c582a9d07cf50cc305145bf4ceb5402fd72ceb910138b9b9cffd0de972d024,positive
NVDA,"The Best Trillion-Dollar AI Stock to Buy Now, According to Wall Street (Hint: Not Nvidia)",1759650300,Yahoo,https://finnhub.io/api/news?id=01a0bd6c2ab31f29f013b8618bdbf98dbe29b4d38554ea7968c69b3007a66099,neutral
NVDA,"The 1-Minute Market Report - October 5, 2025",1759616562,SeekingAlpha,https://finnhub.io/api/news?id=8720c1302dcb820690ee20a211a64ce46f6b38886fd7813902c3a73331257440,neutral
NVDA,October Dogs Of The Dow Flash One Ideal 'Safer' Dividend Buy,1759580287,SeekingAlpha,https://finnhub.io/api/news?id=ede8aec86a85dace884bb5029725f8ffe5cb270d418ef9199a7aae116c46324b,neutral
NVDA,Here's How I'm Positioning For The Biggest Market Disruption Of My Lifetime,1759563000,SeekingAlpha,https://finnhub.io/api/news?id=ad39329ddf9a5b34a5ad369f1c3135856195e0bd575989c264f20901be5c36d7,neutral
NVDA,Neo-Clouds With Gold AI Linings,1759545900,SeekingAlpha,https://finnhub.io/api/news?id=3b5c2b9b751e94b8cd9ca285d0defa47c4f8a79784cd9eef155fafa4419ab184,neutral
NVDA,NVDX: Leveraged Strategy For Secular Growth,1759511688,SeekingAlpha,https://finnhub.io/api/news?id=5740bb0d02292ad90e9a2a4c63ebfce85651c30eadfaeac4633e43c1221fd7af,neutral
NVDA,BC-Most Active Stocks,1759501818,Yahoo,https://finnhub.io/api/news?id=43eb8bbbba4c8b582306ffe3cf155f4dbbe31892413fbddeed04448b24002edd,neutral
NVDA,"Nvidia’s UAE Sales Hit Snag, Report Says, Stock Rises Anyway",1759500720,Yahoo,https://finnhub.io/api/news?id=2defbacdeab3ab8ee7d08e0a8f828de80943449836d8ce926e0c4809b6412085,positive
NVDA,"EXCLUSIVE: FuriosaAI CEO Tells Benzinga 'Nvidia's Greatest Strength Is Also Its Achilles' Heel' After $800M Meta Offer, Targets Series D In 2026",1759500077,Yahoo,https://finnhub.io/api/news?id=17f8ea0a50b28c8d93292b251c7aed72b8d0092e4de262564652492213c0f7fc,neutral
NVDA,Analyst Says Broadcom (AVGO) Not as Expensive ‘As One Might Think’ – Here’s Why,1759499031,Yahoo,https://finnhub.io/api/news?id=97dde143ede8946a5e057b0b8847e1729d9a210569b10236e6482c46de636ef0,neutral
NVDA,"Apple downgraded, Alibaba upgraded: Wall Street's top analyst calls",1759498978,Yahoo,https://finnhub.io/api/news?id=f79967b041a7418231d9fcbd8ace4b4ff3522821280ab055bfee59c2a61ebe52,neutral
NVDA,"Apple Adds a Bear as Jefferies Downgrades, Sees 20% Downside",1759498402,Yahoo,https://finnhub.io/api/news?id=9cf8dcacd1639898e6bec483f151bd527abdde717bb8644f1fdba4e79dd7bfbd,negative
NVDA,NVIDIA Stock Hits 52-Week High: Still Worth Holding or Book Profit?,1759497360,Yahoo,https://finnhub.io/api/news?id=79ace5e424e43b1066954bf4d91bd4ea4972db01f11ffff85239059720c25c8a,neutral
NVDA,"Nvidia UAE Chip Deal Stalls, Testing Patience of CEO Huang",1759496837,Yahoo,https://finnhub.io/api/news?id=6223a96c26d73ae50373ba83dbc4273ed4ba55c2eb0570a2510c3c2d14778da4,negative
NVDA,AMD Stock Rises On Report Intel May Build Chips For Rival,1759496413,Yahoo,https://finnhub.io/api/news?id=5c22653f29ef88e9a43a40486a15b5a47b724138012601c7bf03ef2165ba48c4,positive
NVDA,"Stock Market Today: Dow Rises As Jobs Report Nixed; Astera, Nvidia, Tesla Rally (Live Coverage)",1759495713,Yahoo,https://finnhub.io/api/news?id=6969d0c423a6e0797d05d5c01add29c392e7a3efdfed7370d9ac8b388ce86dec,neutral
NVDA,"KraneShares KSTR ETF Offers U.S. Investors Exposure to Cambricon, “China's answer to Nvidia,” Amid 2025 Rally",1759494600,Yahoo,https://finnhub.io/api/news?id=699e1f92819769766408deef1eda6ab19ff2d778f71c42b7b42831e45f97f9d5,positive
NVDA,BofA expects annual AI investments to nearly triple between CY25-30E to over $1.2T,1759494366,Yahoo,https://finnhub.io/api/news?id=e081f58771b4268efbd3c52ffc18e1a438374ea06059760e2780056511c235c6,positive
NVDA,Why Nebius Group (NBIS) Is Up 16.6% After Securing Microsoft’s Multi-Billion Dollar AI Infrastructure Deal,1759494293,Yahoo,https://finnhub.io/api/news?id=44aa42a73aaa9ec2fe3d217fce142f67060985476356668f4164ecf18356e7fa,positive
NVDA,"New Nvidia deal, Asahi sparks beer shortage fears & Tesla rebounds",1759493030,Yahoo,https://finnhub.io/api/news?id=b0159bb2cbbb113f9440b76e4fe9be919751759e1bcdd1c5cd44ae201aafbcce,negative
NVDA,"Nvidia Returns, Palantir Remains As Top Funds Bet Big 'Dinero' Here",1759492849,Yahoo,https://finnhub.io/api/news?id=c376f2cdc1d78586dda0850f5a4605d6788c5877dc105406d057b14a4059a74f,positive
NVDA,"Spending on AI is increasingly fueled by debt, Goldman Sachs says",1759492789,Yahoo,https://finnhub.io/api/news?id=9ebc8c4a7388b7525a4d5ed5602aae323da0b917095af4f246fabc7eaa943f46,negative
NVDA,AI Chips Today - PEAKAIO Secures Funding to Revolutionize AI Data Infrastructure,1759491471,Yahoo,https://finnhub.io/api/news?id=f32686e9e311f21b2bebab7a3ef76b7db8a5a77876c422e6d345b167e047c64f,positive
NVDA,"Tech Stock Bulls Boost Wall Street Pre-Bell; Asia, Europe Up",1759489707,Yahoo,https://finnhub.io/api/news?id=09cf976b2f06544ac6c3d2f4e38550377e7817f62fb2533384112061c99ff12d,positive
NVDA,"'This Feels Different To Me,' Says Award-Winning Fund Manager",1759489241,Yahoo,https://finnhub.io/api/news?id=1969890b1e0813e06c30f28c405d9f40e8979cc97473fe306d44c1b63c186d3f,positive
NVDA,Top Money Manager Finds 3 Ways To Make Money From Today's 'Noise',1759489210,Yahoo,https://finnhub.io/api/news?id=5c4c24b1b8ddc0cc1316281e006f10c0c28270daa6318b83965e810bf0f15a41,positive
NVDA,Musk ​Goes Head-to-Head With Altman. But This AI Stock Is the Winner.,1759488240,Yahoo,https://finnhub.io/api/news?id=1fa6a7f441ccb4b4810fbb748a821130419c5189ea7b7aaec2950add3b6734a9,neutral
NVDA,"SuperX Launches the Latest XN9160-B300 AI Server, Blackwell Ultra Delivers 50% More Compute Over Blackwell",1759487700,Yahoo,https://finnhub.io/api/news?id=ec57e3d3b9736723c6f8a73ca698915e532e85dc3261811475474a31920b7d9f,neutral
NVDA,Nvidia Stock Rises. It’s Riding a Wave of AI Spending.,1759487700,Yahoo,https://finnhub.io/api/news?id=6eea8887a907e7399871376dcac24a8a28ff6fbd14177b71f3adc1639ebd0e0e,negative
NVDA,Market Chatter: Nvidia Facing Delays to AI Chips Delivery to UAE,1759486400,Yahoo,https://finnhub.io/api/news?id=6fd30fd1cc658959945ffd8b1cca887df568a9ccf5d3e4678f85905a3acbf0ad,negative
NVDA,Nasdaq Futures Gain on AI Optimism,1759486293,Yahoo,https://finnhub.io/api/news?id=34e87d715238ce38a3a56dfb96b7c3221a22d2b2b069a3c28527cc4317836480,negative
NVDA,Nvidia And Fujitsu Team Up To Build AI Systems For The Future,1759486143,Yahoo,https://finnhub.io/api/news?id=1349f8b49bc6aed9f56accbc0a336af00ee83e3c9c21ecedecffdc00462195da,neutral
NVDA,Jim Cramer Says Applied Digital is “Intriguing” but “Loses A Lot of Money”,1759485825,Yahoo,https://finnhub.io/api/news?id=5b0d9d8cd583b3d68859e9989c06ac8f525a361def59c310ba98806c03bc0f2b,neutral
NVDA,"Tesla's tax credits are ending, but the AI benefit is only beginning",1759485656,Yahoo,https://finnhub.io/api/news?id=b51dc7115cf84e36ee000d4483a61901703c9999634e8c6406cade97c1c87937,negative
NVDA,"Nvidia: Market, Market Share, Margins And Multiples Part 2",1759485107,SeekingAlpha,https://finnhub.io/api/news?id=7cba1d51beffa7cd2d8a7d9e67acf5761b70244f085eebd254688fd9d0f19b77,neutral
NVDA,"Stocks to Watch Friday: Applied Materials, Chevron, Broadcom, Nvidia",1759484620,Yahoo,https://finnhub.io/api/news?id=82aec1914e25173a98717342674bbd0a221a415059b1de6dedba84911c7c8b7f,neutral
NVDA,Meet Moore Threads: how former Nvidia vice-president created a Chinese GPU star,1759483800,Yahoo,https://finnhub.io/api/news?id=b1b117b79b9747998319734e1571b55377a9e89aa39e7a23c43b95bec4fa119c,neutral
NVDA,"The Zacks Analyst Blog Highlights NVIDIA, Microsoft, IBM, D-Wave and IonQ",1759482600,Yahoo,https://finnhub.io/api/news?id=ce1b2d2d17a931fe7b1a5c344e4a0a2bd6630e77950686c3a8b99ea9853b7de7,neutral
NVDA,"Trending tickers: Tesla, Alibaba, Occidental, Asahi, Wetherspoon",1759482135,Yahoo,https://finnhub.io/api/news?id=b02529a8b40c40337a36cc417b5f2c8262c790da4f4190ac91248afadc1a19dd,neutral
NVDA,"Nvidia's Stock Is Up Over 1,100% Since 2023. Is It Too Late to Buy?",1759482000,Yahoo,https://finnhub.io/api/news?id=4e2fbf735776f0c5a8826161ca445d66c7c72362697f4ea6ce3b75e862fa46b1,neutral
NVDA,3 Sizzling-Hot AI Stocks That Have Skyrocketed Over 120% This Year,1759481040,Yahoo,https://finnhub.io/api/news?id=c8ba6737b32e677f7058c4172839d51d6fab7491e1369b50750f6103aac1aa14,negative
NVDA,Update: Market Chatter: Microsoft Commits $33 Billion to Neocloud Firms for AI Capacity,1759481017,Yahoo,https://finnhub.io/api/news?id=4454ee94b93fab2ad5842adced4413badaca8a5de982f6b074189663cdf43411,neutral
NVDA,Nvidia Stock vs. Palantir Stock: Wall Street Says Buy One and Sell the Other,1759480500,Yahoo,https://finnhub.io/api/news?id=32dfdb07ae18501912db423b6b101549fe3be3348f3dc465c947deda7024ed9a,neutral
NVDA,"Huawei Used TSMC, Samsung, SK Hynix Components in Top AI Chips",1759480118,Yahoo,https://finnhub.io/api/news?id=79cb1d2d732e0d6f5228154eeb451e613bd96c52940ef3d32b683d6df9657df1,neutral
NVDA,"Intel: From Rival To Partner, How The Chip Game Is Changing",1759479729,SeekingAlpha,https://finnhub.io/api/news?id=94b3ec38f8be325d8e3d831924e2852c840d946fbdd086f7881626fe7f5df197,neutral
NVDA,Intel: I Got This Wrong But Here's Why I'm Still Not Buying Yet,1759478038,SeekingAlpha,https://finnhub.io/api/news?id=8e9380f99ec6b35e644fe4d0c9ff22d58e4eabceae0b3d36de12decb793833f3,neutral
NVDA,Nvidia and Fujitsu agree to work together on AI robots and other technology,1759476674,Yahoo,https://finnhub.io/api/news?id=4c7b1e3e0f87566efafb75948035501e906017aa990d7fdacca314285aa2f19f,positive
NVDA,How I Would Build An Ultra-High-Conviction Retirement Portfolio Right Now,1759476600,SeekingAlpha,https://finnhub.io/api/news?id=1b6afff1c0470663170fb6cb70c8fca876d2574c05f44db7bb82ff6f9f098aa0,neutral
NVDA,2 Tech Stocks That Could Go Parabolic,1759476600,Yahoo,https://finnhub.io/api/news?id=87f3413c5afb8947f63b0877acda9803ada3f42acb1955746e7662fabe92f520,neutral
NVDA,"OpenAI Tie-Up Boosts Hitachi Shares, Fuels Japan Tech Rally",1759462907,Yahoo,https://finnhub.io/api/news?id=bbf22899811125f3f935058c7c7a9e1ba19881717c88e71c9b943930fd5897b0,positive
NVDA,Tech fans Tokyo rally on broadly positive day for Asian markets,1759459850,Yahoo,https://finnhub.io/api/news?id=ad634aaba72ec7c1545bde658f06e2451f8098b8aa4b3ed07cf1d181411179ef,positive
NVDA,CDT Insider Sentiment September 2025: All In,1759457400,SeekingAlpha,https://finnhub.io/api/news?id=afb5744bf17257069c79a8abe1e72efb48b2b26c6b875fd613df7591f37313d4,neutral
NVDA,Intel CEO Lip-Bu Tan Backs $24M Corintis Board As Startup Solves AI's Biggest Bottleneck Problem,1759453284,Yahoo,https://finnhub.io/api/news?id=343ea2808915c143a6804982ef74f2928b6170b399f8d8508a54b6480774846b,positive
NVDA,"Delays to Trump's UAE chips deal frustrate Nvidia's Jensen Huang, officials, WSJ reports",1759453114,Yahoo,https://finnhub.io/api/news?id=81f1115379fca13b6c2e67d15d239859f225eb7ce0730821b77de135a0e1dc02,negative
NVDA,Delays to Trump’s U.A.E. Chips Deal Frustrate Nvidia’s Jensen Huang,1759452300,Yahoo,https://finnhub.io/api/news?id=58512c84b0719a6fa9096cf1091943d8924ac67470ba3701b8e1455f4775add8,negative
NVDA,"CoreWeave's Valuation Soars on Meta Partnership, But Is It Overheating?",1759451621,Yahoo,https://finnhub.io/api/news?id=b94c8eaadbb5565b46d399d368bdfc303c4aa724ffb43999d18c3a8b2626fc0b,positive
NVDA,HostColor Announces Enhanced Dedicated Servers For AI Apps and Projects,1759447440,Yahoo,https://finnhub.io/api/news?id=84f5915164a505818635b5f87db313cc6fe81486d2e671b4d8ad020fdc12cf9e,neutral
NVDA,NVDY: High Yields And NAV Supported By Nvidia's AI Investments,1759442998,SeekingAlpha,https://finnhub.io/api/news?id=52ce70c35a71551c9778de8d784ee0d8fa3ee90409fc0e669e110104b4ca8b43,positive
NVDA,Why the Stock Market Keeps Going Up—Even During a Government Shutdown,1759441920,Yahoo,https://finnhub.io/api/news?id=2defb7852df8d9e73b864924731cdbc62e53017c4590d82314057e4855d24d90,neutral
NVDA,‘I don’t know why I need to go to college’: Ford CEO says his Gen Z son worked as a mechanic and wondered if the 4-year degree was still worth it,1759440502,Yahoo,https://finnhub.io/api/news?id=74d9ac03582f1e39b57ba87b6f071fa087ff14854fa601fbf226ef176f7869a4,neutral
NVDA,"US Equity Indexes Rise Amid Gains in Technology, Investors Taking Government Shutdown in Stride",1759438443,Yahoo,https://finnhub.io/api/news?id=7dcef5804ec9941c80fe4485b0f5a2ed1fb198ce53d17bdf61a45c4f0f5b4f30,negative
NVDA,Crypto AI Sector Valuation Hits $32B as NVIDIA Stock Price Taps All Time Highs,1759436596,Yahoo,https://finnhub.io/api/news?id=5d1f802c1c3520e9c3e4466ee81d96c8b4b98a751e38b0f99decfc2bc6b76726,positive
NVDA,"These Stocks Moved the Most Today: Tesla, Rivian, Occidental, Fair Isaac, Fermi, Kodiak AI, Bullish, Rigetti, and More",1759436160,Yahoo,https://finnhub.io/api/news?id=f689a748f211e0a5d1d518a279f53be6825596f2eb0460b91491031a7f1f7bf9,neutral
NVDA,Stocks Drift to New Highs as Shutdown Rolls on,1759435333,Yahoo,https://finnhub.io/api/news?id=0b6782a76fecfff480f0f02652270c31a8aae658b0e8d73c6dc431bb637b5b74,negative
NVDA,"Dow, S&P 500, Nasdaq notch records on AI buzz even as government shutdown drags on",1759435327,Yahoo,https://finnhub.io/api/news?id=1a76ab18f50030827d2535fb503f2e7aef64f0e9790d297247236f0b833fcdf5,negative
NVDA,"Etsy, Snap, The RealReal, Instacart, and Teladoc Shares Skyrocket, What You Need To Know",1759435246,Yahoo,https://finnhub.io/api/news?id=523e4ba0c5355062d5387edde1e511ec637bee3512870462e2a8967f071dab76,neutral
NVDA,"Revolve and Lyft Shares Are Soaring, What You Need To Know",1759435246,Yahoo,https://finnhub.io/api/news?id=4b451eed837bb3911d0c44773080ab611da6d806b3803a94d4d7e49c5bad3537,neutral
NVDA,"DraftKings' competition in prediction markets, AI stock rally",1759434977,Yahoo,https://finnhub.io/api/news?id=90861dcd1c30740976568367d0273e5f3ced35d4033281085f0c08c240be98e9,neutral
NVDA,"OpenAI now worth $500 billion, possibly making it the world's most valuable startup",1759434934,Yahoo,https://finnhub.io/api/news?id=69e8138102d0c889636179b99f1896299c49844234db8fe5a313a108f1951cc0,positive
NVDA,"Technology, Materials Help Push US Equity Indexes Higher in Final Leg of Trading",1759434589,Yahoo,https://finnhub.io/api/news?id=14ef2942e7b26107e1ace38c42a6dd26be0fad4539f28a67f5169107d891a608,positive
NVDA,A $14 Billion Reason to Buy CoreWeave Stock Here,1759431611,Yahoo,https://finnhub.io/api/news?id=2f3523c13cdf0b804084a51827f84ab75d3b61edc648b914241799f19c61e47a,neutral
NVDA,Stock Market Today: Dow Falls As Jobless Data Gets The Ax; Tesla Jumps On Strong Deliveries (Live Coverage),1759411268,Yahoo,https://finnhub.io/api/news?id=7358a7323209342abdf9e0179e069fd98ca5baee77a5ab5e6a3e46b11c58fe7f,negative
NVDA,DigitalOcean Unveils AI Hub To Supercharge Developer Innovation,1759410839,Yahoo,https://finnhub.io/api/news?id=482562aa56e4c76ce8f05c1d38ff8ba90ff2fbf49051b3b00c257dbe2a1cfe31,neutral
NVDA,Intel Stock Jumps 7% on Report of Early Talks With AMD for Foundry Deal,1759410464,Yahoo,https://finnhub.io/api/news?id=e2aa5092223f6fd4681e816596c0809cb1a687ba6dcdaf1b4e164443e3ec5803,positive
NVDA,Chip stocks rise as OpenAI’s Stargate project fuels AI memory demand hype,1759410331,Yahoo,https://finnhub.io/api/news?id=97b2d7088c824a4d7eb3b778fbc0fbf84526f5a8594dd7fcb2966e9b0fe9db07,negative
NVDA,"SHI Releases 508 Compliance Solution with HPE, NVIDIA, and Kamiwaza",1759410000,Yahoo,https://finnhub.io/api/news?id=2c59efb15dafb4ac84aa80a64849fc342d06d10ae815de377e555126f89df927,positive
NVDA,Climb Channel Solutions named as one of “America’s Greatest Companies 2025” by Newsweek,1759409460,Yahoo,https://finnhub.io/api/news?id=9886c2da6eff4350508a0be035ee137ed4c6059acb66dca88c950b9cffe498d4,positive
NVDA,"Dow Jones Futures Fall, Techs Rise With Tesla Deliveries Due; Nvidia Partner In Buy Zone",1759407481,Yahoo,https://finnhub.io/api/news?id=f7943ecba869bef6ce264e5e32637b15637b6309088b3bdca9b611ab35e8d4cd,negative
NVDA,AI Capex Should Cripple Next Profit Cycle For S&P 500,1759407046,SeekingAlpha,https://finnhub.io/api/news?id=9aad61977056c9c82de5f820c0db07a6b85962f4494b3ac28aef60aea78f7e77,negative
NVDA,Nvidia: Covered Call Option Is The Right Play,1759406843,SeekingAlpha,https://finnhub.io/api/news?id=8bd82920fe850a308fc87155fdefa0a264e26b89c4bf8a3d64e688e3692032e5,neutral
NVDA,Telegram Wallet to Offer Tokenized US Stocks via Kraken and Backed Partnership,1759406448,Yahoo,https://finnhub.io/api/news?id=57638a4a07102333744725b2465246603e42bca7a2efd77375d8d0faf676cf9b,neutral
NVDA,Nvidia-Aligned AI Infrastructure Stock Breaks Out. Top Funds Love It.,1759406430,Yahoo,https://finnhub.io/api/news?id=30f7efafa669fb1803c71b908e8b68c31bbc94d081ebd19ef33d0eed6d97124d,neutral
NVDA,Analysts Say 8 Stocks Already Grow Faster Than Nvidia And Palantir,1759406425,Yahoo,https://finnhub.io/api/news?id=0bedc78054358dffecb0ce3c81d42e885721013554924307d12eaae3bb774681,positive
NVDA,Why AMD Could Burn Investors Chasing The Rally,1759404705,SeekingAlpha,https://finnhub.io/api/news?id=5792b7698e340fc0625152b3580ff0a505fd110a1bc7d90ca5629176730e9da1,neutral
NVDA,Podcast: Will AI Spending Pay Off Or Are We in a Bubble?,1759404344,Yahoo,https://finnhub.io/api/news?id=72046c10bc452fc54f02e8702d0f1bc469416dc559e3a4419547042b7335bc7b,negative
NVDA,"Nvidia, AMD Stocks Rise. How OpenAI Is Driving the AI Chip Rally.",1759404240,Yahoo,https://finnhub.io/api/news?id=6be929456ee8862c54d65cdb08bd960a942298b731251ecc8cc33c959cd3b688,neutral
NVDA,"These Stocks Are Moving the Most Today: Tesla, Occidental, Fair Isaac, Experian, Fermi, Nvidia, and More",1759404060,Yahoo,https://finnhub.io/api/news?id=b57e892dbd96be2b0bf7c1d5d8667f5753456c74a325abba00fc48a8bf78cfc3,neutral
NVDA,Caterpillar Emerges as Unlikely AI Winner on Turbine Demand,1759402800,Yahoo,https://finnhub.io/api/news?id=06d81c700bd0a87dcef7d4b6112f9447b3f99f24ada20d1e8982e5a153f95ff6,positive
NVDA,The9's Singapore Investee NYB Announce Plan to Go Nasdaq via US$1.5 Billion Business Combination with SPAC RF Acquisition Corp II,1759402800,Yahoo,https://finnhub.io/api/news?id=556b6ce1630f2fb762fe01dd4f63c7c2ecec5596b8db32e56bf75f26826f3b55,neutral
NVDA,SMH: AI Bubble? Chip Stocks Are Rewriting History,1759402537,SeekingAlpha,https://finnhub.io/api/news?id=e0b5603728a286bc34a19556afc216689a793b0685e33c8dd45ad745d32d8194,neutral
NVDA,"OpenAI’s Stargate locks in Korean chipmakers, boosting shares",1759402325,Yahoo,https://finnhub.io/api/news?id=49e0f713069ba2178fbeb862404896362628a1ff687d3eab704bd30c9cdf9367,positive
NVDA,"Social Buzz: Wallstreetbets Stocks Mostly Higher Premarket Thursday; Advanced Micro Devices, Opendoor Technologies to Advance",1759402048,Yahoo,https://finnhub.io/api/news?id=316789e1363ab4dc93c8cf3c22a7c233a71900903939f2a502ee8ba246b1e4dd,positive
NVDA,Broadcom: AI Infrastructure Spend Set To Drive Significant Growth,1759401548,SeekingAlpha,https://finnhub.io/api/news?id=fcf65627ae380755db5f3178ee21557d28065b24ea3a1440d951675f9be31b23,positive
NVDA,Palantir's Recent Performance Is A Setup,1759401507,SeekingAlpha,https://finnhub.io/api/news?id=84e903a9d5aa8683122bc63fe8ec9791fc626aa23da85658fca3631fd2d1ab1c,positive
NVDA,Alibaba Stock Is on a Tear. Why China AI Excitement Is Building.,1759399800,Yahoo,https://finnhub.io/api/news?id=84e91b4d168c0b6405a10108f533f442ff61125013ba552bf3a32e8efda39bef,negative
NVDA,Microsoft Bets $33 Billion on Neoclouds like Nebius to Ease AI Crunch,1759399200,Yahoo,https://finnhub.io/api/news?id=64de3f1e1ec27c550078a3e7132670dbca3e21f715c48f676bacef1dcf4a4f0c,positive
NVDA,3 Blue Chip Stocks That Have Soared 380% (and Higher) Over the Past 5 Years,1759397220,Yahoo,https://finnhub.io/api/news?id=2ddcc979b64168d6d2b9595c6d33636a28e93546de86932388b4bbbbda5bd717,positive
NVDA,CoreWeave Or Nebius? I'd Pick This One To Outperform,1759395600,SeekingAlpha,https://finnhub.io/api/news?id=d0b68c8904f6b4fd2eb5acd677540a3d0cac4ca80a682cc16944f5f2835b2624,neutral
NVDA,I Wouldn't Dare Buy These 3 Popular Investments Right Now,1759390200,SeekingAlpha,https://finnhub.io/api/news?id=651ed23cdcb71f30f4a23c4a27919cdecbd0c3ca046bbe7e960223711edc9ac7,neutral
NVDA,"SCHD: If You're Considering Selling, Buy QDVO Instead",1759386600,SeekingAlpha,https://finnhub.io/api/news?id=90462e3cb84e6fbd454dc8a373fb57ed8b92c41ddbd5514290b867c60aa67782,neutral
NVDA,"Dow Jones Futures: Stock Market Hits Highs, Tesla Deliveries Due; Nvidia Partner Breaks Out",1759374114,Yahoo,https://finnhub.io/api/news?id=15436dc4ccae425e61b849d52f0d9a478a033863c22d02115296a9e7895b61c5,positive
NVDA,"Marjorie Taylor Greene Loads Up On Six-Figure Treasury Bill— Diversifies Portfolio With Bitcoin ETF, Tech Stocks",1759361446,Yahoo,https://finnhub.io/api/news?id=8db24e35778a5077962dd57d5c106f2eb6283d78c3d6cbde959e497c4c2cfba1,neutral
NVDA,Microsoft Partners with Nvidia as Cloud and AI Drive Strong Performance,1759352803,Yahoo,https://finnhub.io/api/news?id=2d232ab37ee0b518e0a58f2e328cef93b27d904fe19064da3c271ff42071070a,positive
NVDA,Analyst on Intel (INTC): $5 Billion Nvidia Investment ‘No Big Deal’,1759351569,Yahoo,https://finnhub.io/api/news?id=09c69963aa2b55aa7a9e59eb269c3545da88075c751d3560c0d3125f28a2c0f0,neutral
NVDA,Is KLA (KLAC) the Best Under-The-Radar AI Stock to Buy Now?,1759351183,Yahoo,https://finnhub.io/api/news?id=dc34359b0675a35d59e442851b4fc3d24bd14887c2a9c5a249a6e470e32f8b06,neutral
NVDA,2 Great AI Stocks to Buy in October and Hold for 10 Years,1759350900,Yahoo,https://finnhub.io/api/news?id=ccd042cbd302821582309205d10717e943ba4348ab832d3edcf1dc0bd9292700,neutral
NVDA,Analyst Highlights Red Flags in Nvidia (NVDA)-OpenAI $100 Billion Deal – ‘Feature of Past Bubbles’,1759350487,Yahoo,https://finnhub.io/api/news?id=68a1065d6c48ac486ddc0debb832a9d869602ad38de1c72151bae6662eb8d32a,positive
NVDA,"These Stocks Moved the Most Today: Nike, Netflix, Fermi, Moderna, AES, Lithium Americas, Sunrun, Corteva, and More",1759350000,Yahoo,https://finnhub.io/api/news?id=6f5dbb34fdca4091ef3f86a6189a28cc3580cf82103a42749f49ef93744a9269,neutral
NVDA,Jim Cramer Was Right About Meta Platforms (META),1759349788,Yahoo,https://finnhub.io/api/news?id=f539204f7f62de17625b4e98da9b2ac53af02be209c1f10f0a24dd9dc94ff7ba,neutral
NVDA,Why AbbVie (ABBV) Stock Is Trading Up Today,1759348870,Yahoo,https://finnhub.io/api/news?id=0bca266385a251b952a1b7183256ddbcec174ee33956b13388248144a702acf7,neutral
NVDA,OpenAI Is Breaking New Ground With Sora. Why the AI Video App Is Bad News for Meta.,1759348620,Yahoo,https://finnhub.io/api/news?id=ddb7f3b5570e300c7153cd0cea5c9f82ba94e80224165c2e59e27c0d3ff1d363,negative
NVDA,Analyst Says He’s Not ‘Worried At All’ About Nvidia (NVDA)’s Customer Concentration Problem,1759348181,Yahoo,https://finnhub.io/api/news?id=3a149deceb6e75f216b070ccec100ca167285149626ab79aac5de81a8ce26d57,neutral
