ticker,headline,datetime,source,url,sentiment
NVDA,Nvidia On Winning Streak Amid Government Shutdown – But Is The Stock A Buy Now?,1759347143,Yahoo,https://finnhub.io/api/news?id=146cc4923601063cf4afef471c830e7a7c7db9be9f327520c188aa307cf28b8f,neutral
NVDA,CoreWeave lands mega deal from AI giant,1759345980,Yahoo,https://finnhub.io/api/news?id=6499e911d4dc7558846641c6bd5b293bf6e997576763dc15ef984842374fe984,neutral
NVDA,Intel Stock Rallies On Report Chip Giant Looking To Add AMD As Foundry Customer,1759344503,Yahoo,https://finnhub.io/api/news?id=b50b2c3cc2ed3a1b95e2ba747e68ee2aadcbbea5a179698f3c5a1fe7f383a2b9,positive
NVDA,Intel: Be On The Safe Side And Trim (Rating Downgrade),1759343977,SeekingAlpha,https://finnhub.io/api/news?id=7985a0410f80bb56983275281ac22720beb2865bb00770369cb99d58509f8c78,neutral
NVDA,Intel spikes on reports of potential AMD manufacturing deal,1759343857,Yahoo,https://finnhub.io/api/news?id=1d5fb7d6b206d9e1bd8a4f1067c59e78c68dd47fc0dafb165e609cef78d54557,negative
NVDA,"Now Up 70% in 2025, Is Intel Stock a Buy, Sell, or Hold for Q4?",1759342416,Yahoo,https://finnhub.io/api/news?id=aca39005532d77316e7751af76d52363b92cab6edc9a489f03534e51529e9f94,neutral
NVDA,AI Stocks: Bubble or Boom Ahead?,1759341840,Yahoo,https://finnhub.io/api/news?id=172e9eedd73bc1bf1ce25956fcbbe80bcd665ca094442769021f4e0303f85f41,neutral
NVDA,Nvidia Stock Falls From Record High as Meta Accelerates Custom AI Chip,1759340943,Yahoo,https://finnhub.io/api/news?id=05383e237da4961744c76b29a8432962817d9570fa8d38e4c278fafb7075133b,negative
NVDA,Stock Market Today: Dow Slips As Trump 'Generating Plant' Stock Pops On Debut (Live Coverage),1759338446,Yahoo,https://finnhub.io/api/news?id=70669e0b925877351a468d2758c17f69a73755e682acdfdf1ecf8fe229416e2c,negative
NVDA,What Is One of the Best Semiconductor Stocks to Own for the Next Decade?,1759338103,Yahoo,https://finnhub.io/api/news?id=bfc9aabc1b97799aa0fc198eec1b2022a8d005fec4c9d5165545137cdd7c803f,neutral
NVDA,Nvidia Crosses Record $4.53 Trillion in Market Cap,1759337231,Yahoo,https://finnhub.io/api/news?id=5226061770faa6265cbc08f9ff1824265e06471a3fc90a4abd3c02e8c87054e0,neutral
NVDA,Meta Reportedly Eyes Rivos AI Chip Startup Deal,1759336989,Yahoo,https://finnhub.io/api/news?id=ba94ba65753b69b9ea6f210ee6a5c9edb501d9451fdb7ca4a44fe25fb7792efa,neutral
NVDA,Huawei To Ramp Up AI Chip Production In 2026,1759336901,Yahoo,https://finnhub.io/api/news?id=3f5404359e17cf1995ddc985424e55e32dc371c85945ac3fa4e3e7b90026bd81,positive
NVDA,"These S&P 500 Stocks Stood Out in Q3 2025: Western Digital, Warner Bros Discovery, Seagate, Corning, Teradyne",1759336510,Yahoo,https://finnhub.io/api/news?id=74ce702a719feb6d45fd3c82fdf7113d3a3add66e7df1b9124137bb45b53b13a,neutral
NVDA,Nvidia: AI's Profit Problem Meets Its Power Problem (Rating Downgrade),1759333873,SeekingAlpha,https://finnhub.io/api/news?id=d2dcd8e4459b986961fbe6ef32cf0b425234235e7e1e833d7d1716c79b300890,negative
NVDA,Elevated P/E Ratios: Get Used To It (And Embrace It),1759332423,SeekingAlpha,https://finnhub.io/api/news?id=c1ae51ef1333f72879dd240effb4c160ca825ff841ffe0863f7981a9fbead6d7,positive
NVDA,All Cap Investing With Kirk Spano,1759332000,SeekingAlpha,https://finnhub.io/api/news?id=8791af52a3096427d13adc649c16e421f787043433d1e4dd8f1271517ee62e03,neutral
NVDA,Microsoft Uses Microfluidics Tech to Outpace AI Chip Rivals,1759332000,Yahoo,https://finnhub.io/api/news?id=f29845bc5aeaf9394ad94bd10e4f8473ba8445fae47b9de4edcb9047c60f7da8,neutral
NVDA,"Solidigm Unveils AI Central Lab, Home to Highest-Performing and Most Dense Storage Test Clusters",1759330800,Yahoo,https://finnhub.io/api/news?id=0fbda75e373364a5f1ac492a75e50b834811d63c62887e4ad4e3d8018f5604e5,positive
NVDA,Nvidia Becomes First Company to Reach $4.53 Trillion Market Cap,1759329528,Yahoo,https://finnhub.io/api/news?id=b896cd18dcdef0e2c6ef4bc7351f27e2716297e820598ceea5d65bcf661707ea,neutral
NVDA,CoreWeave Is Winning Over Wall Street Amid Flurry of New Deals,1759327806,Yahoo,https://finnhub.io/api/news?id=9912108a1a1d79fd4800f8f4cd2de6c8376a85c1dbd342dfdcf53641dfb7a7f8,positive
NVDA,ASML Has Fans Ahead of Earnings. 2 Reasons to Believe in the Stock.,1759327680,Yahoo,https://finnhub.io/api/news?id=093c5dfe581d549c2d4a0b76d756855dfdcd0367c885d24b68c22359bbb88963,neutral
NVDA,Nvidia Stock Drops. Meta Is Pushing Ahead with Its Own AI Chips.,1759327320,Yahoo,https://finnhub.io/api/news?id=84d1d8838b703c53d641476f04d8b6e9a639475130bcfb8ff0c275324f714d5d,negative
NVDA,Intel's Comeback Is Just Getting Started (Rating Upgrade),1759326539,SeekingAlpha,https://finnhub.io/api/news?id=4e57297b42a5a72224193b0a0275c4c00eaa82b0d953fd0686424668f71216f2,neutral
NVDA,1 Super Semiconductor Stock (Besides Nvidia or Broadcom) to Buy Hand Over Fist,1759326300,Yahoo,https://finnhub.io/api/news?id=f2cd5f76f214c2a84aebc40535d856c7237d96e4af1681590031f843e3393645,neutral
NVDA,"If You'd Invested $10,000 in CoreWeave Stock 6 Months Ago, Here's How Much You'd Have Today",1759325580,Yahoo,https://finnhub.io/api/news?id=d7a2dc1e5ad8e36263962adc06e22351de2029d27e1a534fdb37e1197b9f921d,neutral
NVDA,"3D Digital Asset Market Surges to $51.8 billion by 2029 - Dominated by Autodesk (US), Siemens (Germany), Adobe (US)",1759325400,Yahoo,https://finnhub.io/api/news?id=05f7913beeb41e0ae927a4e27559c05e6730004f1a6b2944b4670be5abb25215,positive
NVDA,Cadence and TSMC Extend Partnership to Drive Next-Generation Innovation,1759325400,Yahoo,https://finnhub.io/api/news?id=b84188365125061ed1fe64792925c1c178b45ed231108fddc00f3c91dec65376,positive
NVDA,"PainReform Provides Business Update for the Six Months Ended June 30, 2025",1759325220,Yahoo,https://finnhub.io/api/news?id=13f8f9f68025b42d1ab46c6ab267936153f7d192674fe43f636c26b084a979a7,neutral
NVDA,Collaborative Fund Leads Phaidra's $50M+ Series B to Build the AI Factories of the Future,1759323600,Yahoo,https://finnhub.io/api/news?id=5e58fff066d141832f84ab81efcbcc9a01f8e5a02b6a815d4ca3384eedbe79d4,positive
NVDA,‘2 Out of 3 Ain’t Bad’ When It Comes to Charting the S&P 500’s Top 3 Stocks,1759322701,Yahoo,https://finnhub.io/api/news?id=a919acd0085579d41906705d1c1bbde1191ccaec8226aaf2e45588655edbf54a,neutral
NVDA,Dow Jones Futures Fall As Government Shutdown Begins After Nvidia Breaks Out,1759318373,Yahoo,https://finnhub.io/api/news?id=33b5caea45d3baea77d9b01fbd6438249413c070a46e1904a482f82c2c728508,negative
NVDA,"Samsung, SK Hynix set to supply chips to OpenAI's Stargate project",1759317735,Yahoo,https://finnhub.io/api/news?id=e5a8b74146b16ae7be85b36707fc54c34f03cd4c55631a627ae3649f2411468f,neutral
NVDA,"Social Buzz: Wallstreetbets Stocks Mostly Lower; Lithium Americas to Advance, Reddit to Decline",1759315680,Yahoo,https://finnhub.io/api/news?id=721b1ff9b841229617a47aab214774e778c6bd5db9c327af64ece9ec5969db9e,negative
NVDA,Oracle: The 'Nvidia Moment' Is Here And I'm Loading Up,1759315348,SeekingAlpha,https://finnhub.io/api/news?id=df7daca31beacad53f2e03d116b4025b6bedbc5c7ba06822a9c0ac25ca67988f,neutral
NVDA,"Nscale Announces $433 Million Pre-Series C SAFE, Building on Historic $1.1B Series B Momentum",1759315080,Yahoo,https://finnhub.io/api/news?id=1e95f37557db7dfaa413dee6cb693716e8946c5698d9fe9bd990e7d736b5e73f,positive
NVDA,A Once-in-a-Decade Opportunity: 17 Billion Reasons to Pay Attention to This Monster Artificial Intelligence (AI) Infrastructure Company (Hint: Not Nvidia),1759314600,Yahoo,https://finnhub.io/api/news?id=2c344d8c5f625f373ccf1467b2f38f8cb08e4191cba7a20871c50f2d1fa1998a,neutral
NVDA,Nvidia and OpenAI Just Upped the Ante in AI. Here's What Investors Should Watch.,1759314600,Yahoo,https://finnhub.io/api/news?id=b147736a3234017eccdf75e3c389d07f5a367f54d176da8b76916164ca1acbe8,neutral
NVDA,Is IonQ a Buy?,1759313700,Yahoo,https://finnhub.io/api/news?id=c5a0ae840cedde60d15bd42f22c9df5764e0bdfb5a9111cc9de71e1ebe8134d0,neutral
NVDA,"These Stocks Are Moving the Most Today: Nvidia, Nike, Occidental, AppLovin, AES, Lithium Americas, and More",1759313340,Yahoo,https://finnhub.io/api/news?id=95a0c0ed21eae0aadfec695cd107006a790b7a13f83eab6dfa8cce91f06be47a,neutral
NVDA,"After Getting a $5 Billion Investment From Nvidia, Is It Off to the Races for Intel's Stock?",1759311900,Yahoo,https://finnhub.io/api/news?id=03407841e77a106e4a9b9cd53b48c112754cce65a7e257b07d58990e6f4cd57a,neutral
NVDA,CoreWeave: The Takeoff Recovery Has Already Started (Upgrade),1759311570,SeekingAlpha,https://finnhub.io/api/news?id=b0af3d3f10a1c90f3615323dbc2578630eadfa4f3cff72aea12027e960429c32,neutral
NVDA,"AI PC Research Report 2025-2035: Market to Reach $992 Billion by 2035 at a CAGR of 32.16%, Driven by NVIDIA, Apple, AMD, Lenovo, Microsoft, Dell, HP, Fujitsu, ASUSTeK, Intel, and Huawei",1759310160,Yahoo,https://finnhub.io/api/news?id=18e9deae056f8d2482a35b6a2c1e99686575aae049cfad4e1838f08415e4d05b,positive
NVDA,"There's a Bubble Forming in the Stock Market, but It's Not in Artificial Intelligence (AI). History Says This Happens Next.",1759310100,Yahoo,https://finnhub.io/api/news?id=3aa937fbb9771492e8c7109d36422e0afab6465fb228bcd33338f50dcac5149f,neutral
NVDA,The Newest Stock in the S&P 500 Is Obliterating Nvidia and Palantir This Year. Is It Too Late to Buy?,1759308840,Yahoo,https://finnhub.io/api/news?id=a6ddcdf1ec5099e874055ff7ab43229d44383f7e7dd4e5a51f52ba6ed47d8319,negative
NVDA,NVDY: An Assessment Of How My Investment Is Actually Doing,1759307428,SeekingAlpha,https://finnhub.io/api/news?id=d3695b34491ce83300f3e0647b043144cd0378d9e98d9135f63fd8b3c295eee5,neutral
NVDA,2 High-Yield ETFs to Buy Hand Over Fist and 1 to Avoid,1759307100,Yahoo,https://finnhub.io/api/news?id=a75e4322dc8366df9e32e9639647fa245a81d2ae9047bc7a541873e49ebb31df,neutral
NVDA,"The Best AI Stock to Buy Right Now, According to a Wall Street Analyst (Hint: Not Nvidia or Palantir)",1759306320,Yahoo,https://finnhub.io/api/news?id=8eff85bbc2ac554e7f3ae602be1c928fc59995294a0e0fb05cca0b142818de37,neutral
NVDA,Prediction: This Will Be Nvidia's Stock Price in 2030,1759306200,Yahoo,https://finnhub.io/api/news?id=e79f2902f877dcacfbf1a41542fa216939bddbf0e42dce67e66337b2d8cd502c,neutral
NVDA,"2 ""Magnificent Seven"" Stocks to Buy Hand Over Fist in October",1759306020,Yahoo,https://finnhub.io/api/news?id=aa9096576b4735b84c45ed06e4ef3db80c7f273a4b73365a41424976f72d15dc,neutral
NVDA,3 Underrated AI ETFs With Multi-Million Dollar Potential,1759305600,Yahoo,https://finnhub.io/api/news?id=79fbd22b3da857d768f7c0bffa90faebd3c16e38a98ff30154ca59ae22e7d9ad,neutral
NVDA,"Zacks Investment Ideas feature highlights: Amazon, Apple, Nvidia and Meta",1759303560,Yahoo,https://finnhub.io/api/news?id=25ddd38dc13fe0ad272e78c5c605c44da38efa3f396d6cb7d36f7dfe8cdac851,neutral
NVDA,"Zacks Investment Ideas feature highlights: CoreWeave, Nvidia and Meta Platforms",1759302360,Yahoo,https://finnhub.io/api/news?id=68b4604c76f77740f6c894005e66fff69b2b934acae9b0ace87b14e097eb3b58,neutral
NVDA,"Wall Street Breakfast Podcast: Senate Vote Triggers Government Shutdown, Data Delays",1759300183,SeekingAlpha,https://finnhub.io/api/news?id=77450285176e2f85cc468f7484b6764c4881c5a1046892f781dfd6c5c6affefd,neutral
NVDA,Jefferies Lifts PT on NVIDIA Corporation (NVDA) Stock,1759300048,Yahoo,https://finnhub.io/api/news?id=f0254d1fc54ff2161c5027f5fde0a82eb8aecf7e7fe9784f81c6e33e944f7a6e,neutral
NVDA,Data Center Reality: Whispers From Data Center Alley,1759296300,SeekingAlpha,https://finnhub.io/api/news?id=5b37685eca3b3aa844a8df22122ac614267204be561d965a054aade5a6d3295a,neutral
NVDA,All The Focus Is On A.I.,1759290000,SeekingAlpha,https://finnhub.io/api/news?id=f20ef8993fa92951e61a975f91a7e09882feffb09ff13c4bf863a6724b944b0e,neutral
NVDA,Alibaba: The Nvidia Partnership Adds Fuel To The Fire,1759254979,SeekingAlpha,https://finnhub.io/api/news?id=ebab29057d2e093440ec919efb5276dbe6160b5132e545444f80b4fc3d31f5c1,neutral
NVDA,US Equity Indexes Retreat as Federal Government Heads for Partial Shutdown,1759252192,Yahoo,https://finnhub.io/api/news?id=cae7a40ef466e488812b844773578fc53ff6c448225fc7fe2ea5e63066d4a97a,negative
NVDA,Why Nvidia-Backed CoreWeave's Stock Is Soaring Today,1759251978,Yahoo,https://finnhub.io/api/news?id=5f530a9364d61093b050de7c0f3adfd3707eb989e1859478a9eb1e6b7bb4a51d,positive
NVDA,"UiPath (PATH) Shares Skyrocket, What You Need To Know",1759251058,Yahoo,https://finnhub.io/api/news?id=c7d4a8852ce5445f26c26f9dce956db04d5754ff30f05219f246ab830d82a698,neutral
NVDA,NVIDIA Corporation (NVDA) and OpenAI Forge $100B Partnership to Power Next-Gen AI Systems,1759250882,Yahoo,https://finnhub.io/api/news?id=d338ee32d12d2ec666956671ac333bee84e404b73ce9cafeced74c3ddf3445a7,positive
NVDA,The Nvidia-Intel Alliance: What It Means for AI and Crypto Infrastructure,1759249730,Yahoo,https://finnhub.io/api/news?id=7725f51cfa4bceb3618247d85115758924345cedcbaa431b5cf397fa0382b0e8,neutral
NVDA,Nvidia Stock Hits Bullish Trigger Amid Massive AI Deals - Is Nvidia A Buy Now?,1759249677,Yahoo,https://finnhub.io/api/news?id=05f501f6997b328c36576a1c1c7657dc3ba55a2781036409e390ee94d5870e02,neutral
NVDA,Stock Market Today: Stocks Down After Downbeat Consumer Data; Nvidia Hits New High (Live Coverage),1759248362,Yahoo,https://finnhub.io/api/news?id=3c78be9fbc3c485f4af57ff2cecd303138bb8ad4a21ab22d3eec539ea2d26133,negative
NVDA,"Nvidia stock high, Wolfspeed exits bankruptcy, Pfiezer drug prices",1759248354,Yahoo,https://finnhub.io/api/news?id=2d739030e86296ca74a55548514a9800353f92cb4354c828236c311ac14cdce9,neutral
NVDA,Cisco Introduces Agentic Capabilities for Next-Generation Collaboration,1759248000,Yahoo,https://finnhub.io/api/news?id=8221e305b16d93f23b8ce8cfca34421ff3be6825f143cfe81110f2e400734e92,neutral
NVDA,Why Shares of UiPath Are Soaring Today,1759246827,Yahoo,https://finnhub.io/api/news?id=67172c9e4f6d67c90e630a5714752aa1abd634d87ee2781d4d67f9753c593425,positive
NVDA,UiPath Stock Rises Sharply. What OpenAI and Nvidia Have to Do With It.,1759246500,Yahoo,https://finnhub.io/api/news?id=ac0abfda3afc183143854df1eea4c711f44e64d51e2ad2c5ffdf25b7a4f14099,neutral
NVDA,Nvidia Stock Is on Pace for a Record High. Can It Keep Its Lead Over AMD?,1759245360,Yahoo,https://finnhub.io/api/news?id=5f11e739662e57f35f7f0058edae43da82805bc31a58c43886aa06ab61a89eb6,positive
NVDA,Microsoft Accelerates AI Investment to Fend Off Stiff AI Competition,1759245240,Yahoo,https://finnhub.io/api/news?id=c633f3c09ec2a894fac4493796f70614689bc3a3a886020ed1c6b802e20217fc,positive
NVDA,"Don't Fear AI Bubble, There Will Be Winners - Tech Contrarians",1759244700,SeekingAlpha,https://finnhub.io/api/news?id=58d9aaaca47d8b88156dad7f0db721bb33b7ec62dfa9956c05ea755a691e09c6,neutral
NVDA,America’s AI Boom Faces a Supply Crisis — Jim Rickards Says the Solution Lies Beneath Our Feet,1759244400,Yahoo,https://finnhub.io/api/news?id=d85901d789beb853e6efd225fbb9bfffa3be68b5d6c63ea10f41a045529734f3,neutral
NVDA,Nvidia’s CEO Jensen Huang says electricians and plumbers will be needed by the hundreds of thousands in the new working world,1759244318,Yahoo,https://finnhub.io/api/news?id=876ead978b91e19fddb3cac7f56117dae10f8f0fcd4e3c9cc7e70e9236cc5c74,neutral
NVDA,CoreWeave initiated at Outperform by Evercore on AI infrastructure demand,1759244242,Yahoo,https://finnhub.io/api/news?id=0121071fe02d6eb6e73a0a6f4e21737ae2d0a9f6e65859423477c0716c0ef4d7,positive
NVDA,"Hertz, UiPath & Nvidia, EchoStar and Verizon: Trending Tickers",1759243131,Yahoo,https://finnhub.io/api/news?id=eea915a04ce1422e1e0cca3992bb05e4786ba9a52ed3c82028d5f8abf2afa6e0,neutral
NVDA,Logitech Targets Hybrid Work Needs With Zone Wireless 2 Launch,1759242600,Yahoo,https://finnhub.io/api/news?id=8385582b0fbe8ccb56a147ed91690f6b897e453945bc5984318d7914997270b6,neutral
NVDA,I'm Starting To Believe AI Is A Bubble: The Curious Case Of OpenAI,1759240955,SeekingAlpha,https://finnhub.io/api/news?id=8fbd56213453602f6638231671c203fdcfeffa8c169eec1775288f5e229a6c7b,neutral
NVDA,"These Stocks Are Moving the Most Today: Wolfspeed, CoreWeave, Intel, Spotify, Jefferies, Firefly, Progress Software, and More",1759240500,Yahoo,https://finnhub.io/api/news?id=3dee0ae024ae76b60ced36a0db0686fd0e00b4cc024b924862232ca936223c4e,neutral
NVDA,"CoreWeave Inks $14 Billion Meta Deal, Highlighting AI Demand",1759239502,Yahoo,https://finnhub.io/api/news?id=e3b7b8cd47854e14337018f77d7db32c30fd0615e45ddd62fafe7f734a925861,positive
NVDA,Nvidia: Still The Best Risk-Reward In AI Hardware,1759239111,SeekingAlpha,https://finnhub.io/api/news?id=e4b596c5da456ca8f682ea8c37b55818adfbd3ee19bf56678f908dd9f3d52bda,positive
NVDA,Nvidia Stock Edges Up. Can It Keep Its Lead Over AMD?,1759238640,Yahoo,https://finnhub.io/api/news?id=8d7521af7196f767113eb9528db1d40aa1c54e49e877554ea5db62e9365b45f4,positive
NVDA,CoreWeave Stock Climbs on $14 Billion AI Cloud Computing Deal With Meta,1759238640,Yahoo,https://finnhub.io/api/news?id=b20c441c1d99d24ffb77dbdaaeab0292414df9bdca00657e5e75ca1e5f370dbb,positive
NVDA,Stock Market Today: Dow Falls Amid Economic Data; Nvidia Stock Nears Buy Point (Live Coverage),1759238471,Yahoo,https://finnhub.io/api/news?id=7468e032018554d77803daf7d1c5f5147ff0b6c494cbc194361896af060a09ee,negative
NVDA,CoreWeave stock soars after $14.2 billion Meta computing deal,1759238069,Yahoo,https://finnhub.io/api/news?id=f9b9c8a971211bddbb0627f10dce8c6affe04c98d862435f325142669140eaef,positive
NVDA,VAST Data and SDS Partner to Build One of Israel’s Largest Sovereign AI Cloud,1759237800,Yahoo,https://finnhub.io/api/news?id=ab1079d38001637f47715436d41e45cf9e785b440d225e9cf93828218bc760df,positive
NVDA,"AI chip firm Cerebras raises $1.1 billion, adds Trump-linked 1789 Capital as investor",1759237399,Yahoo,https://finnhub.io/api/news?id=f46faa378da2e5d469b992f1115068cd64b7cc06ac2733b5202360072e1e9341,positive
NVDA,VDURA Joins Ultra Ethernet Consortium to Reinvent Networking for the AI Era,1759237260,Yahoo,https://finnhub.io/api/news?id=46e908c75f6d4542a8102e9dd8b2831cb394746adc89f7d548af4b7860e52af6,neutral
NVDA,"Grafana Labs Surpasses $400M ARR and 7,000 Customers, Gains New Investors to Accelerate Global Expansion",1759237200,Yahoo,https://finnhub.io/api/news?id=ddab8549739968d05d55bc636df401147c3eff66d325dce4a57f19ae159ba145,positive
NVDA,"Intel Stock Rally Cools After Deutsche Bank Target Cut, Investor Says Pullback Is Normal",1759236774,Yahoo,https://finnhub.io/api/news?id=a4dbb80e8533850b7f727dd237c3d7e2043e0c9f3d6a00726d25d24951ff01fb,negative
NVDA,Nvidia Stock Climbs as Wall Street Doubles Down on Its AI Lead,1759236691,Yahoo,https://finnhub.io/api/news?id=cfeb39da39c97c00d6de581e76eed1357787354cd2285374fc5717a0facaf2e0,negative
NVDA,"2 Growth Stocks to Invest $1,000 in Right Now",1759236540,Yahoo,https://finnhub.io/api/news?id=dde2953408f79a915e441e361a301f51e2510425e2f1f59b1b7644e78fcbb16e,neutral
NVDA,"3 Things: Tariffs, OpenAI revenue, EA & dealmaking",1759235900,Yahoo,https://finnhub.io/api/news?id=313d3d9606d3d5a16150480536a36f5626d33ad037613cf10065b6dc2871159d,neutral
NVDA,UiPath Delivers Trusted Agentic Automation for Sensitive Workflows with NVIDIA,1759235400,Yahoo,https://finnhub.io/api/news?id=236136a7b64e944f7402841ae6051810aebfbab5d2d6017116165949c641a483,neutral
NVDA,Market Movers: The rise of China's AI,1759235302,Yahoo,https://finnhub.io/api/news?id=2420cade5b4d8bfa8d12372a739ae7b3da62dc06965793a542df541acacfbb7d,neutral
NVDA,TSMC stock target raised at Morgan Stanley on expected earnings beat,1759234343,Yahoo,https://finnhub.io/api/news?id=624f004cbf8e4b69bec04f3b11e7e2e969ff200f76f967fa07aaf92e1d43d17b,positive
NVDA,"Analyst Highlights the Nvidia Link in Micron (MU) Business, Says It’s ‘The Most Important Takeaway’",1759234066,Yahoo,https://finnhub.io/api/news?id=45f83bde6856115cee418234c1221b356e1ca008f2d90fa28b41755298534dba,neutral
NVDA,Let's Talk About SCHD And Its Miserable 5-Year Track Record,1759231723,SeekingAlpha,https://finnhub.io/api/news?id=db2834ac2e2eda58fe172c9ffeb654ea0b9eefc6a8a413ef244eab18d6f36cee,negative
NVDA,CRWV vs. GOOGL: Which AI Infrastructure Stock is the Better Buy Now?,1759231380,Yahoo,https://finnhub.io/api/news?id=a8fc463af5961f0c9af6dcc3d97cf621c42f3647def8e7dedd4082204a2c1ac9,neutral
NVDA,What Is One of the Best AI Hardware Stocks to Buy Today?,1759229640,Yahoo,https://finnhub.io/api/news?id=ac73751071b16bc276e24bbabdf6bc86713471102246ed1b429488ba0eb54662,neutral
NVDA,"These 2 AI stocks stand out as supply chain winners, says KeyBanc",1759225409,Yahoo,https://finnhub.io/api/news?id=7df0e8a89da906a019ab9995a0f9f32035fca0d54ea36d42d5b70108db16a5a2,positive
NVDA,Why Nvidia's $100 Billion Bet On OpenAI Makes (Some) Sense (Rating Upgrade),1759224954,SeekingAlpha,https://finnhub.io/api/news?id=49a48717c730673c35e3bc32332d7ef877a004304bff172cc3196ed1a7f1942f,neutral
NVDA,From Buyer To Builder: How China Is Overcoming U.S. Semiconductor Sanctions,1759220400,SeekingAlpha,https://finnhub.io/api/news?id=1a49002d8f6633bae65ff71c06037d2bf4fc91832d6646449cac0cf1216957c1,neutral
NVDA,Will a Stock Market Crash Follow the AI Boom? Billionaire Ken Griffin Warns About Echoes of the Dot-Com Bubble.,1759219500,Yahoo,https://finnhub.io/api/news?id=00f74b49494e5508084b7791022c1e6cbd499b84c0ab9f00a3578d8750ea7ccf,negative
NVDA,NVDL: Several Reasons To Be Bullish On NVIDIA Into Year-End,1759214374,SeekingAlpha,https://finnhub.io/api/news?id=1ad6b323485f5ce3559a1f0524dab7cdb38704f1d2ed4f099228a47bf6f067f4,neutral
NVDA,"NVIDIA (NVDA) Price Target Raised to $240 by Barclays, Named ‘Most Attractive’ AI Stock",1759209862,Yahoo,https://finnhub.io/api/news?id=bf649352efa5cec1f6dae926d56c0d5eb571865f1a11a565ca8f6410614ff4fd,positive
NVDA,Apple is falling out of love with Labour’s Britain,1759208400,Yahoo,https://finnhub.io/api/news?id=19902808c9dda127832c23a1171057d24ab8852e25b096a34d861b334dfb4d62,negative
NVDA,"Top Stocks today: Tilray, Alibaba gain; Novo Nordisk slips",1759204306,Yahoo,https://finnhub.io/api/news?id=ad347b1f7e853f69407151c4556fc1720eb6c058ebf3d9138bf3efd7613ee8f1,positive
NVDA,"3 Growth Stocks to Invest $1,000 Right Now",1759194360,Yahoo,https://finnhub.io/api/news?id=2fb1909baec5fdbf1ce13f33e1a77ce7c655eb5ba97368622e29a463f3006ede,neutral
NVDA,"Jensen Huang Fires Back At Wall Street 'Flatlining' Nvidia Forecasts, Says AI Demand Will Crush Long-Term Expectations",1759188704,Yahoo,https://finnhub.io/api/news?id=7b4aefc674b4abc5d52d6f2883f8743e358bbb51b047ac138c55661b4f75a281,negative
NVDA,Will Amazon Stock Keep Rebounding This Year?,1759188480,Yahoo,https://finnhub.io/api/news?id=d4c5391ff8950a088af5885dc9a8d2e6669f8d15937320806f063826ebf4f44a,positive
NVDA,NVIDIA Strengthens AI Leadership Through OpenAI Partnership and Record Growth,1759187586,Yahoo,https://finnhub.io/api/news?id=3e1f57975a9572426e58642b288bb9d6ee116e8dd9ef792f3dcbe82a5d999066,positive
NVDA,"S&P 500, Nasdaq Inches Higher As AI Stocks Recover From Last Week's Selloff",1759187449,Yahoo,https://finnhub.io/api/news?id=224425dc1aa720b6d4d7875d7f9ff6808d7c90df25a8624ada12da3a674c90ec,positive
NVDA,These 2 Nuclear Stocks Have Been Red Hot in 2025,1759184820,Yahoo,https://finnhub.io/api/news?id=608ba19e68165ac6e1164de4f8b13b017c6d958826b3435462d965dcbfb75509,negative
NVDA,Nvidia (NVDA) Beats Stock Market Upswing: What Investors Need to Know,1759182303,Yahoo,https://finnhub.io/api/news?id=10c70db1e99a21b85535820ef81e7e0fb655420655297c5ecb74155fca362b8c,neutral
NVDA,"Dow Jones Futures: Nvidia Stock, Palantir Eye Buy Points, But AI Names Broadcom, Oracle Fall",1759179933,Yahoo,https://finnhub.io/api/news?id=8cabd8478f2549609c5102294cb076f12f12b3b394543166f40c11ab1da2bb19,neutral
NVDA,Equities Edge Higher in Choppy Trade; Potential Government Shutdown in Focus,1759179921,Yahoo,https://finnhub.io/api/news?id=4784cc23b8474367ea1182dfb0a26685d05e31c2782f8403cf05560e31fb785a,negative
NVDA,Technology Helps Push US Equity Indexes Higher; Gold Hits Record Amid Government Shutdown Concerns,1759179471,Yahoo,https://finnhub.io/api/news?id=fe0ee20b29ccf01a95162440486301f47b3ecbecf6cea413ec0117c2de145189,positive
AMZN,"'All news is good news': Wall Street shrugs off government shutdown, jobs report delay",1759676409,Yahoo,https://finnhub.io/api/news?id=990912dfdd5168a39b827132052c91903658fd9752bb0ad5f4a5d5363508c7e4,negative
AMZN,"Wall Street, crypto industry say tokenization will reshape global markets: 'It’s going to eat the entire financial system'",1759671005,Yahoo,https://finnhub.io/api/news?id=bc3d53bf653acf166de547edf6082268739be3ae72c5a6fd554f90ee2bff63f2,negative
AMZN,Analyst on Amazon (AMZN): ‘AWS Will Accelerate’,1759669232,Yahoo,https://finnhub.io/api/news?id=802a8f39758ea324953a06e0bb3d80dd1ed193429ad0787c97afeefdfd78dcae,positive
AMZN,Startups Are Eating Big Food’s Lunch,1759656600,Yahoo,https://finnhub.io/api/news?id=a0afb51c82e97813855bcda7f49d950b1a3fce8f7f3101f3c16c5c4c129bef77,neutral
AMZN,"ETG: A Consistent Income Payer With Global Equity Exposure, 7.3% Yield",1759652100,SeekingAlpha,https://finnhub.io/api/news?id=d29cd9bedca08a001951cba20c068db9c4483337cd90451b6ff4fed78c2a0ab4,positive
AMZN,"Goldman Sachs, Morgan Stanley To Lead Amazon-Backed Beta Technologies $300M GE Deal And IPO As Military-Trained Electric Aircraft Firm Expands",1759622425,Yahoo,https://finnhub.io/api/news?id=2bec49be6a824c8e9a84f3305ea497a65d94d7a2a91619a408e72ce8144d5ab5,neutral
AMZN,Jim Cramer on Peloton: “They’re a Little Bit Too Hype Oriented for Me”,1759611702,Yahoo,https://finnhub.io/api/news?id=613519bc93bd141384eff8c8faf509d71f137064e120ebef3ff65a5371e457af,neutral
AMZN,"Amazon Launches New ‘Amazon Grocery’ Private Label, Unifies Fresh & Happy Belly Brands",1759611298,Yahoo,https://finnhub.io/api/news?id=5b2b33fc9efa08fda9ed01efb5aeecd9c40047bf1fd3572b5adc50130ed1b508,neutral
AMZN,Prediction: 1 Artificial Intelligence (AI) Stock Will Be Worth More Than Alphabet and Amazon Combined by 2030 (Hint: Not Nvidia),1759592700,Yahoo,https://finnhub.io/api/news?id=40a2392e27b9ccb54b2f3caa77cbcff8fcc0ae863036872e14ef70da70145c76,neutral
